id,title,weblink,enabledby,comingintoforcedate,comingintoforcenote,prefix,year,precededbyproposedstatutoryinstrument,triplestoreid
4127,Bracknell Forest (Electoral Changes) Order 2021,https://www.legislation.gov.uk/ukdsi/2021/9780348224542,urn:procedure-editor:ActOfParliament:949,,in accordance with article 1(2) and (3),SI,2021,"",NqCLFLTw
4128,St Albans (Electoral Changes) Order 2021,https://www.legislation.gov.uk/ukdsi/2021/9780348224566,urn:procedure-editor:ActOfParliament:949,,"in accordance with article 1(2), (3) and (4)",SI,2021,"",v6bxt3tk
4130,Bank of England Act 1998 (Macro-prudential Measures) (Amendment) Order 2021,https://www.legislation.gov.uk/ukdsi/2021/9780348224665,urn:procedure-editor:ActOfParliament:1034,,,SI,2021,"",ZRNy2pyR
4133,Fisheries Act 2020 (Scheme for Financial Assistance) (England) Regulations 2021,https://www.legislation.gov.uk/ukdsi/2021/9780348224696,urn:procedure-editor:ActOfParliament:1345,,,SI,2021,"",DVjaTy0s
4135,European Union (Future Relationship) Act 2020 (References to the Trade and Cooperation Agreement) Regulations 2021,https://www.legislation.gov.uk/ukdsi/2021/9780348224672,urn:procedure-editor:ActOfParliament:12,,,SI,2021,"",qHKl23ei
4136,Major Sporting Events (Income Tax Exemption) (2021 UEFA Super Cup) Regulations 2021,https://www.legislation.gov.uk/ukdsi/2021/9780348224726,urn:procedure-editor:ActOfParliament:1191,2021-07-31,,SI,2021,"",DGCn66AY
4137,Medical Devices (Northern Ireland Protocol) Regulations 2021,https://www.legislation.gov.uk/ukdsi/2021/9780348224740,urn:procedure-editor:ActOfParliament:1,,,SI,2021,"",EqN2hQoC
4141,Medical Devices (Coronavirus Test Device Approvals) (Amendment) Regulations 2021,https://www.legislation.gov.uk/ukdsi/2021/9780348224795,urn:procedure-editor:ActOfParliament:24,,,SI,2021,"",RXWRJm79
4142,Central Bedfordshire (Electoral Changes) Order 2021,https://www.legislation.gov.uk/ukdsi/2021/9780348224771,urn:procedure-editor:ActOfParliament:949,,in accordance with article 1(2) and (3),SI,2021,"",LF79fVdf
4143,North Kesteven (Electoral Changes) Order 2021,https://www.legislation.gov.uk/ukdsi/2021/9780348224764,urn:procedure-editor:ActOfParliament:949,,in accordance with article 1(2) and (3),SI,2021,"",aFrwUcJr
4146,Railway (Licensing of Railway Undertakings) (Amendment) Regulations 2021,https://www.legislation.gov.uk/ukdsi/2021/9780348224979,urn:procedure-editor:ActOfParliament:200,,"Regulations 1, 2 and 14 to 19, 30 Sep 2021, Regulations 3 to 13 at 11pm on 31 Jan 2022",SI,2021,urn:procedure-editor:PublishedDraftUnderTheEuropeanUnionWithdrawalAct2018:4479,AOXw1uHq
4147,Electricity Capacity (Amendment) Regulations 2021,https://www.legislation.gov.uk/ukdsi/2021/9780348224870,urn:procedure-editor:ActOfParliament:863,,,SI,2021,"",HR4eaEzn
4149,"Occupational Pension Schemes (Administration, Investment, Charges and Governance) (Amendment) Regulations 2021",https://www.legislation.gov.uk/ukdsi/2021/9780348224788,"urn:procedure-editor:ActOfParliament:1061,urn:procedure-editor:ActOfParliament:107,urn:procedure-editor:ActOfParliament:452,urn:procedure-editor:ActOfParliament:908",2021-10-01,,SI,2021,"",sJsIEMvL
4150,Motor Fuel (Composition and Content) and the Biofuel (Labelling) (Amendment) (No. 2) Regulations 2021,https://www.legislation.gov.uk/ukdsi/2021/9780348224856,urn:procedure-editor:ActOfParliament:1016,,in accordance with regulation 1(2) and (3),SI,2021,urn:procedure-editor:PublishedDraftUnderTheEuropeanUnionWithdrawalAct2018:4480,zvx2iVDo
4154,Health and Social Care Act 2008 (Regulated Activities) (Amendment) (Coronavirus) Regulations 2021,https://www.legislation.gov.uk/ukdsi/2021/9780348224993,urn:procedure-editor:ActOfParliament:1265,,,SI,2021,"",st4lp11z
4157,London Borough of Havering (Electoral Changes) Order 2021,https://www.legislation.gov.uk/ukdsi/2021/9780348225112,urn:procedure-editor:ActOfParliament:949,,in accordance with article 1(2) and (3),SI,2021,"",U7Myq85A
4158,Medway (Electoral Changes) Order 2021,https://www.legislation.gov.uk/ukdsi/2021/9780348225099,urn:procedure-editor:ActOfParliament:949,,in accordance with article 1(2) and (3),SI,2021,"",B0Zpk0UV
4162,Pensions Regulator (Employer Resources Test) Regulations 2021,https://www.legislation.gov.uk/ukdsi/2021/9780348225204,urn:procedure-editor:ActOfParliament:1061,2021-10-01,,SI,2021,"",KRxG2ujT
4187,Merchant Shipping (Prevention of Air Pollution from Ships) (Amendment) Regulations 2021,https://www.legislation.gov.uk/ukdsi/2021/9780348225587,urn:procedure-editor:ActOfParliament:411,,,SI,2021,urn:procedure-editor:PublishedDraftUnderTheEuropeanUnionWithdrawalAct2018:4481,pKDEx8nT
4188,Organics (Equivalence and Control Bodies Listing) (Amendment) Regulations 2021,https://www.legislation.gov.uk/ukdsi/2021/9780348225570,urn:procedure-editor:ActOfParliament:10,,,SI,2021,"",R6m4FRKK
4189,Conference of the Parties to the United Nations Framework Convention on Climate Change (Immunities and Privileges) Order 2021,https://www.legislation.gov.uk/ukdsi/2021/9780348225624,urn:procedure-editor:ActOfParliament:2731,,in accordance with article 1,SI,2021,"",L4Wttblf
4190,Licensing Act 2003 (2020 UEFA European Championship Licensing Hours) Order 2021,https://www.legislation.gov.uk/ukdsi/2021/9780348225617,urn:procedure-editor:ActOfParliament:897,2021-07-10,,SI,2021,"",edOYPlpl
4191,Conference of the Parties to the United Nations Framework Convention on Climate Change (Immunities and Privileges) Order 2021,https://www.legislation.gov.uk/ukdsi/2021/9780348225730,urn:procedure-editor:ActOfParliament:2731,,in accordance with article 1,SI,2021,"",HCxS3C6R
4200,Capital Requirements Regulation (Amendment) Regulations 2021,https://www.legislation.gov.uk/ukdsi/2021/9780348225846,"urn:procedure-editor:ActOfParliament:1,urn:procedure-editor:ActOfParliament:1383",2022-01-01,,SI,2021,"",kXXWEcYI
4202,Terrorism Act 2000 (Proscribed Organisations) (Amendment) (No. 2) Order 2021,https://www.legislation.gov.uk/ukdsi/2021/9780348225815,urn:procedure-editor:ActOfParliament:176,,,SI,2021,"",oOT7aGcW
4223,Internal Market Information System Regulation (Amendment etc.) Regulations 2021,https://www.legislation.gov.uk/ukdsi/2021/9780348226126,urn:procedure-editor:ActOfParliament:1,,,SI,2021,"",390SFgFv
4224,Water and Sewerage Undertakers (Exit from Non-household Retail Market) (Consequential Provision) Regulations 2021,https://www.legislation.gov.uk/ukdsi/2021/9780348226157,urn:procedure-editor:ActOfParliament:1292,2021-10-31,,SI,2021,"",CIX0v9VE
4226,Food (Promotion and Placement) (England) Regulations 2021,https://www.legislation.gov.uk/ukdsi/2021/9780348226195,"urn:procedure-editor:ActOfParliament:1080,urn:procedure-editor:ActOfParliament:1230",2022-10-01,,SI,2021,"",NqZENfJL
4232,East Staffordshire (Electoral Changes) Order 2021,https://www.legislation.gov.uk/ukdsi/2021/9780348226218,urn:procedure-editor:ActOfParliament:949,,in accordance with article 1(2) and (3),SI,2021,"",L7AUmTYX
4233,Norfolk (Electoral Changes) Order 2021,https://www.legislation.gov.uk/ukdsi/2021/9780348226201,urn:procedure-editor:ActOfParliament:949,,"in accordance with article 1(2), (3) and (4)",SI,2021,"",L1FRKoBS
4234,Rochdale (Electoral Changes) Order 2021,https://www.legislation.gov.uk/ukdsi/2021/9780348226225,urn:procedure-editor:ActOfParliament:949,,in accordance with article 1(2) and (3),SI,2021,"",uCIuHtka
4260,Charities Act 2011 (Exempt Charities) (British Council) Regulations 2021,https://www.legislation.gov.uk/ukdsi/2021/9780348226973,urn:procedure-editor:ActOfParliament:38,,,SI,2021,"",MB2Rf3LA
4261,National Security and Investment Act 2021 (Monetary Penalties) (Turnover of a Business) Regulations 2021,https://www.legislation.gov.uk/ukdsi/2021/9780348226942,urn:procedure-editor:ActOfParliament:1389,2022-01-04,,SI,2021,"",ILr2YIm0
4262,National Security and Investment Act 2021 (Notifiable Acquisition) (Specification of Qualifying Entities) Regulations 2021,https://www.legislation.gov.uk/ukdsi/2021/9780348226935,urn:procedure-editor:ActOfParliament:1389,2022-01-04,,SI,2021,"",p1dzuqS0
4263,Heavy Commercial Vehicles in Kent (No. 1) (Amendment) Order 2021,https://www.legislation.gov.uk/ukdsi/2021/9780348227048,"urn:procedure-editor:ActOfParliament:938,urn:procedure-editor:ActOfParliament:503",2021-10-31,,SI,2021,"",mmV2e4Og
4269,Social Security (Scotland) Act 2018 (Disability Assistance for Children and Young People) (Consequential Modifications) (No. 2) Order 2021,https://www.legislation.gov.uk/ukdsi/2021/9780348226898,urn:procedure-editor:ActOfParliament:1289,,,SI,2021,"",cpSbVxUV
4278,Green Gas Support Scheme Regulations 2021,https://www.legislation.gov.uk/ukdsi/2021/9780348227284,urn:procedure-editor:ActOfParliament:662,,,SI,2021,"",txkL9pHq
4301,Antique Firearms (Amendment) Regulations 2021,https://www.legislation.gov.uk/ukdsi/2021/9780348227413,urn:procedure-editor:ActOfParliament:2710,,,SI,2021,"",G5ncbTl8
4311,Conformity Assessment (Mutual Recognition Agreements) (Construction Products) (Amendment) Regulations 2021,https://www.legislation.gov.uk/ukdsi/2021/9780348227420,urn:procedure-editor:ActOfParliament:1375,,,SI,2021,"",AJlp478i
4312,Motor Vehicles (Driving Licences) (Amendment) (No. 2) Regulations 2021,https://www.legislation.gov.uk/ukdsi/2021/9780348227581,urn:procedure-editor:ActOfParliament:1298,2021-11-15,,SI ,2021,"",bPmqor5J
4352,Double Taxation Relief and International Tax Enforcement (Taiwan) Order 2021,https://www.legislation.gov.uk/ukdsi/2021/9780348228137,"urn:procedure-editor:ActOfParliament:338,urn:procedure-editor:ActOfParliament:1219",,,SI,2021,"",FNprbrR1
4353,Age of Criminal Responsibility (Scotland) Act 2019 (Consequential Provisions and Modifications) Order 2021,https://www.legislation.gov.uk/ukdsi/2021/9780348228052,urn:procedure-editor:ActOfParliament:1289,2021-12-17,,SI,2021,"",3EkjTPda
4354,Motor Vehicles (Driving Licences) (Amendment) (No. 4) Regulations 2021,https://www.legislation.gov.uk/ukdsi/2021/9780348228113,urn:procedure-editor:ActOfParliament:1298,2021-11-15,,SI,2021,"",uaiU1zl6
4359,Eggs (England) Regulations 2021,https://www.legislation.gov.uk/ukdsi/2021/9780348228175,urn:procedure-editor:ActOfParliament:10,2022-01-01,,SI,2021,"",B9spdHxk
4365,Local Audit (Appointing Person) (Amendment) Regulations 2021,https://www.legislation.gov.uk/ukdsi/2021/9780348228182,urn:procedure-editor:ActOfParliament:988,,,SI,2021,"",vdr30aKp
4375,Network and Information Systems (EU Exit) (Amendment) Regulations 2021,https://www.legislation.gov.uk/ukdsi/2021/9780348228267,urn:procedure-editor:ActOfParliament:1,,,SI,2021,"",XYcXSSoU
4376,London Borough of Barking and Dagenham (Electoral Changes) Order 2021,https://www.legislation.gov.uk/ukdsi/2021/9780348228335,urn:procedure-editor:ActOfParliament:949,,in accordance with article 1(2) and (3),SI,2021,"",ogAGB3TI
4377,Royal Borough of Greenwich (Electoral Changes) Order 2021,https://www.legislation.gov.uk/ukdsi/2021/9780348228359,urn:procedure-editor:ActOfParliament:949,,in accordance with article 1(2) and (3),SI,2021,"",FjjBExBn
4378,St Helens (Electoral Changes) Order 2021,https://www.legislation.gov.uk/ukdsi/2021/9780348228366,urn:procedure-editor:ActOfParliament:949,,in accordance with article 1(2) and (3),SI,2021,"",4V2UYS2K
4380,Coronavirus Act 2020 (Early Expiry) (No. 2) Regulations 2021,https://www.legislation.gov.uk/ukdsi/2021/9780348228465,urn:procedure-editor:ActOfParliament:1326,,,SI,2021,"",sSr2cNs8
4383,Companies (Strategic Report) (Climate-related Financial Disclosure) Regulations 2021,https://www.legislation.gov.uk/ukdsi/2021/9780348228519,urn:procedure-editor:ActOfParliament:1183,2022-04-06,,SI,2021,"",1OcNLYNq
4385,Financial Services Act 2021 (Prudential Regulation of Credit Institutions and Investment Firms) (Consequential Amendments and Miscellaneous Provisions) Regulations 2021,https://www.legislation.gov.uk/ukdsi/2021/9780348228489,"urn:procedure-editor:ActOfParliament:1383,urn:procedure-editor:ActOfParliament:1,urn:procedure-editor:ActOfParliament:1282,urn:procedure-editor:ActOfParliament:25,urn:procedure-editor:ActOfParliament:1034",,in accordance with regulation 1(2) and (3),SI,2021,"",5M6P0VpS
4386,Electric Vehicles (Smart Charge Points) Regulations 2021,https://www.legislation.gov.uk/ukdsi/2021/9780348228434,urn:procedure-editor:ActOfParliament:1095,2022-06-30,,SI,2021,"",5dFL4UGb
4400,Regulatory Enforcement and Sanctions Act 2008 (Amendment to Schedule 3) (England) Order 2021,https://www.legislation.gov.uk/ukdsi/2021/9780348228502,"urn:procedure-editor:ActOfParliament:1669,urn:procedure-editor:ActOfParliament:1230",,,SI,2021,"",MKlxrqjK
4404,Human Medicines (Amendment etc.) (EU Exit) (No. 2) Regulations 2021,https://www.legislation.gov.uk/ukdsi/2021/9780348228755,urn:procedure-editor:ActOfParliament:1,,,SI,2021,"",jTNVV7GO
4405,International Organization for Marine Aids to Navigation (Legal Capacities) Order 2022,https://www.legislation.gov.uk/ukdsi/2022/9780348228618,urn:procedure-editor:ActOfParliament:2731,, in accordance with article 1,SI,2022,"",KsK6nBNs
4406,Terrorism Prevention and Investigation Measures Act 2011 (Continuation) Order 2021,https://www.legislation.gov.uk/ukdsi/2021/9780348228649,urn:procedure-editor:ActOfParliament:39,2021-12-13,,SI,2021,"",z4fBLprw
4410,Merchant Shipping (Control and Management of Ships' Ballast Water and Sediments) Order 2022,https://www.legislation.gov.uk/ukdsi/2022/9780348228748,urn:procedure-editor:ActOfParliament:411,,,SI,2022,"",JQW4Uc7G
4416,Consumer Scotland Act 2020 (Consequential Provisions and Modifications) Order 2022,https://www.legislation.gov.uk/ukdsi/2022/9780348228847,urn:procedure-editor:ActOfParliament:1289,,,SI,2022,"",H67KKTFR
4417,Renewable Transport Fuel Obligations (Amendment) Order 2021,https://www.legislation.gov.uk/ukdsi/2021/9780348228854,urn:procedure-editor:ActOfParliament:909,2022-01-01,,SI,2021,urn:procedure-editor:PublishedDraftUnderTheEuropeanUnionWithdrawalAct2018:4482,uKosYvBz
4419,Health and Social Care Act 2008 (Regulated Activities) (Amendment) (Coronavirus) (No. 2) Regulations 2021,https://www.legislation.gov.uk/ukdsi/2021/9780348228861,urn:procedure-editor:ActOfParliament:1265,,in accordance with regulation 1(2) and (3),SI,2021,"",Fnr7K4ER
4422,Air Traffic Management and Unmanned Aircraft Act 2021 (Airspace Change Directions) (Determination of Turnover for Penalties) Regulations 2022,https://www.legislation.gov.uk/ukdsi/2022/9780348229004,urn:procedure-editor:ActOfParliament:1376,,,SI,2022,"",JuXOMQ46
4423,Transport Act 2000 (Air Traffic Services Licence Modification Appeals) (Prescribed Aerodromes) Regulations 2022,https://www.legislation.gov.uk/ukdsi/2022/9780348229011,urn:procedure-editor:ActOfParliament:46,,,SI,2022,"",13RqxTtu
4424,Customs Safety and Security Procedures (EU Exit) (No. 2) Regulations 2021,https://www.legislation.gov.uk/ukdsi/2021/9780348228984,urn:procedure-editor:ActOfParliament:1,2021-12-31,,SI,2021,"",AYmVaMD1
4425,Solvency 2 (Group Supervision) (Amendment) Regulations 2021,https://www.legislation.gov.uk/ukdsi/2021/9780348228991,urn:procedure-editor:ActOfParliament:1,2022-01-24,,SI,2021,"",kgoMQIhb
4430,Civil Partnership (Scotland) Act 2020 and Marriage and Civil Partnership (Scotland) Act 2014 (Consequential Modifications) Order 2022,https://www.legislation.gov.uk/ukdsi/2022/9780348228960,urn:procedure-editor:ActOfParliament:1289,,,SI,2022,"",9WrK1pPl
4431,London Borough of Lambeth (Electoral Changes) Order 2022,https://www.legislation.gov.uk/ukdsi/2022/9780348229059,urn:procedure-editor:ActOfParliament:949,,In accordance with article 1(2) and (3).,SI,2022,"",0TEJoAT1
4435,Civil Jurisdiction and Judgments (2005 Hague Convention and 2007 Hague Convention) (Amendment) Regulations 2022,https://www.legislation.gov.uk/ukdsi/2022/9780348229141,urn:procedure-editor:ActOfParliament:1356,,,SI,2022,"",smajG1ic
4444,Terrorism Act 2000 (Proscribed Organisations) (Amendment) (No. 3) Order 2021,https://www.legislation.gov.uk/ukdsi/2021/9780348229288,urn:procedure-editor:ActOfParliament:176,,,SI,2021,"",RdyalQEX
4449,Wine (Amendment) Regulations 2021,https://www.legislation.gov.uk/ukdsi/2021/9780348229356,urn:procedure-editor:ActOfParliament:12,2022-01-01,,SI,2021,"",g1DjtGVb
4450,Motor Vehicles (Driving Licences) (Amendment) (No. 5) Regulations 2021,https://www.legislation.gov.uk/ukdsi/2021/9780348229349,"urn:procedure-editor:ActOfParliament:1,urn:procedure-editor:ActOfParliament:1298",,,SI,2021,"",fcOcl2W7
4460,Motor Vehicles (Driving Licences) (Amendment) Regulations 2022,https://www.legislation.gov.uk/ukdsi/2022/9780348229516,urn:procedure-editor:ActOfParliament:1298,,,SI,2022,urn:procedure-editor:PublishedDraftUnderTheEuropeanUnionWithdrawalAct2018:4485,sFt0wqSY
4467,"Small Business, Enterprise and Employment Act 2015 and Pubs Code etc. (Amendment) Regulations 2021",https://www.legislation.gov.uk/ukdsi/2021/9780348229561,urn:procedure-editor:ActOfParliament:1330,2022-04-01,,SI,2021,"",FpfgHA1K
4478,Train Driving Licences and Certificates (Amendment) Regulations 2022,https://www.legislation.gov.uk/ukdsi/2022/9780348229738,urn:procedure-editor:ActOfParliament:200,,,SI,2022,urn:procedure-editor:PublishedDraftUnderTheEuropeanUnionWithdrawalAct2018:4483,bCy7BVVO
4499,Bury (Electoral Changes) Order 2022,https://www.legislation.gov.uk/ukdsi/2022/9780348229899,urn:procedure-editor:ActOfParliament:949,,in accordance with articles 1(2) and (3),SI,2022,"",4dG16QWv
4500,Gosport (Electoral Changes) Order 2022,https://www.legislation.gov.uk/ukdsi/2022/9780348229905,urn:procedure-editor:ActOfParliament:949,,in accordance with article 1(2) and (3),SI,2022,"",xpycF1h6
4501,Data Protection Act 2018 (Amendment of Schedule 2 Exemptions) Regulations 2022,https://www.legislation.gov.uk/ukdsi/2022/9780348229967,urn:procedure-editor:ActOfParliament:1033,,in accordance with regulation 1(2) ,SI,2022,"",TABYtNyd
4510,Health and Social Care Act 2008 (Regulated Activities) (Amendment) Regulations 2022,https://www.legislation.gov.uk/ukdsi/2022/9780348230369,urn:procedure-editor:ActOfParliament:1265,2022-03-30,,SI,2022,"",V9x2wxEl
4512,Trade Union (Levy Payable to the Certification Officer) Regulations 2022,https://www.legislation.gov.uk/ukdsi/2022/9780348230185,urn:procedure-editor:ActOfParliament:555,2022-04-01,,SI,2022,"",0TVRnd1g
4513,Trade Union (Power of the Certification Officer to Impose Financial Penalties) Regulations 2022,https://www.legislation.gov.uk/ukdsi/2022/9780348230215,urn:procedure-editor:ActOfParliament:555,2022-04-01,,SI,2022,"",IBTG39ha
4517,Misuse of Drugs Act 1971 (Amendment) Order 2022,https://www.legislation.gov.uk/ukdsi/2022/9780348230321,urn:procedure-editor:ActOfParliament:2522,,,SI,2022,"",m9Tkyf25
4532,Competition Appeal Tribunal (Recording and Broadcasting) Order 2022,https://www.legislation.gov.uk/ukdsi/2022/9780348230604,urn:procedure-editor:ActOfParliament:1316,,,SI,2022,"",V2XVPP2d
4533,Occupational Pension Schemes (Collective Money Purchase Schemes) Regulations 2022,https://www.legislation.gov.uk/ukdsi/2022/9780348230505,"urn:procedure-editor:ActOfParliament:22,urn:procedure-editor:ActOfParliament:145,urn:procedure-editor:ActOfParliament:908",2022-08-01,,SI,2022,"",cYg6595b
4548,Microchipping of Dogs (England) (Amendment) Regulations 2022,https://www.legislation.gov.uk/ukdsi/2022/9780348230796,urn:procedure-editor:ActOfParliament:1328,,,SI,2022,"",Hxy0LAJA
4549,Greenhouse Gas Emissions Trading Scheme (Amendment) Order 2022,https://www.legislation.gov.uk/ukdsi/2022/9780348230802,urn:procedure-editor:ActOfParliament:1350,,,SI,2022,"",0x2aZO15
4550,Money Laundering and Terrorist Financing (Amendment) Regulations 2022,https://www.legislation.gov.uk/ukdsi/2022/9780348230871,urn:procedure-editor:ActOfParliament:1338,2022-03-09,,SI,2022,"",E8ujPD6q
4551,"Passenger, Crew and Service Information (Civil Penalties) (Amendment) Regulations 2022",https://www.legislation.gov.uk/ukdsi/2022/9780348230789,"urn:procedure-editor:ActOfParliament:2565,urn:procedure-editor:ActOfParliament:1238",2022-03-31,,SI,2022,"",nsSvtrsD
4554,Representation of the People (Proxy Vote Applications) (Coronavirus) (Amendment) Regulations 2022,https://www.legislation.gov.uk/ukdsi/2022/9780348230925,"urn:procedure-editor:ActOfParliament:61,urn:procedure-editor:ActOfParliament:1718",2022-02-27,,SI,2022,"",SINwNMsx
4555,Non-Domestic Rating (Levy and Safety Net) (Amendment) Regulations 2022,https://www.legislation.gov.uk/ukdsi/2022/9780348230901,urn:procedure-editor:ActOfParliament:397,,,SI,2022,"",pDkpIbWZ
4559,"Divorce, Dissolution and Separation Act 2020 (Consequential Amendments) Regulations 2022",https://www.legislation.gov.uk/ukdsi/2022/9780348230949,urn:procedure-editor:ActOfParliament:1309,,in accordance with regulation 1(2),SI,2022,"",eyIAofCc
4560,Goods Vehicles (Licensing of Operators) (Amendment) Regulations 2022,https://www.legislation.gov.uk/ukdsi/2022/9780348230987,"urn:procedure-editor:ActOfParliament:353,urn:procedure-editor:ActOfParliament:1,urn:procedure-editor:ActOfParliament:12",,in accordance with regulation 2,SI,2022,"",PX3gR8bU
4563,Immigration and Nationality (Fees) (Amendment) Order 2022,https://www.legislation.gov.uk/ukdsi/2022/9780348231007,urn:procedure-editor:ActOfParliament:1300,,,SI,2022,"",5ataUoJX
4566,Mesothelioma Lump Sum Payments (Conditions and Amounts) (Amendment) Regulations 2022,https://www.legislation.gov.uk/ukdsi/2022/9780348230932,urn:procedure-editor:ActOfParliament:79,2022-04-01,,SI,2022,"",7FKsaBQK
4567,Pneumoconiosis etc. (Workers' Compensation) (Payment of Claims) (Amendment) Regulations 2022,https://www.legislation.gov.uk/ukdsi/2022/9780348230994,urn:procedure-editor:ActOfParliament:1944,2022-04-01,,SI,2022,"",cbeNXkQ9
4570,Waste and Agriculture (Legislative Functions) Regulations 2022,https://www.legislation.gov.uk/ukdsi/2022/9780348231113,urn:procedure-editor:ActOfParliament:1,,,SI,2022,"",JYBE31Kg
4573,Major Sporting Events (Income Tax Exemption) (2022 Birmingham Commonwealth Games) Regulations 2022,https://www.legislation.gov.uk/ukdsi/2022/9780348231120,urn:procedure-editor:ActOfParliament:1191,2022-06-30,,SI,2022,"",wKfPbFqa
4574,Major Sporting Events (Income Tax Exemption) (UEFA Women’s EURO 2022 Finals) Regulations 2022,https://www.legislation.gov.uk/ukdsi/2022/9780348231168,urn:procedure-editor:ActOfParliament:1191,2022-06-30,,SI,2022,"",vT75uimA
4575,Guaranteed Minimum Pensions Increase Order 2022,https://www.legislation.gov.uk/ukdsi/2022/9780348231076,urn:procedure-editor:ActOfParliament:452,2022-04-06,,SI,2022,"",HUwKV9x5
4576,Occupational Pension Schemes (Collective Money Purchase Schemes) Regulations 2022,https://www.legislation.gov.uk/ukdsi/2022/9780348231182,urn:procedure-editor:ActOfParliament:145,2022-08-01,,SI,2022,"",C9Hd8h8Q
4577,"Social Security (Contributions) (Rates, Limits and Thresholds Amendments and National Insurance Funds Payments) Regulations 2022",https://www.legislation.gov.uk/ukdsi/2022/9780348231175,urn:procedure-editor:ActOfParliament:589,2022-04-06,,SI,2022,"",lgpiuj9F
4578,Social Security Benefits Up-rating Order 2022,https://www.legislation.gov.uk/ukdsi/2022/9780348231151,urn:procedure-editor:ActOfParliament:528,,in accordance with article 1(3) and (4),SI,2022,"",YFD1NBDC
4579,"Tax Credits, Child Benefit and Guardian's Allowance Up-rating Regulations 2022",https://www.legislation.gov.uk/ukdsi/2022/9780348231205,urn:procedure-editor:ActOfParliament:795,,in accordance with article 1(2) and (3),SI,2022,"",Y2mCJYYC
4588,Early Legal Advice Pilot Scheme Order 2022,https://www.legislation.gov.uk/ukdsi/2022/9780348231311,urn:procedure-editor:ActOfParliament:1329,,,SI,2022,"",yTeDkU6K
4590,Bedford (Electoral Changes) Order 2022,https://www.legislation.gov.uk/ukdsi/2022/9780348231212,urn:procedure-editor:ActOfParliament:949,,in accordance with article 1(2) and (3),SI,2018,"",NsNxeGw0
4592,Grants to the Churches Conservation Trust Order 2022,https://www.legislation.gov.uk/ukdsi/2022/9780348231281,urn:procedure-editor:ActOfParliament:2660,2022-04-01,,SI,2022,"",GflQet0Z
4593,Genetically Modified Organisms (Deliberate Release) (Amendment) (England) Regulations 2022,https://www.legislation.gov.uk/ukdsi/2022/9780348231328,urn:procedure-editor:ActOfParliament:165,,,SI,2022,"",ZFUQvuiI
4595,Scotland Act 2016 (Social Security) (Adult Disability Payment and Child Disability Payment) (Amendment) Regulations 2022,https://www.legislation.gov.uk/ukdsi/2022/9780348231335,urn:procedure-editor:ActOfParliament:1336,,in accordance with regulation 1(1),SI,2022,"",6npLtgHD
4596,Cumbria (Structural Changes) Order 2022,https://www.legislation.gov.uk/ukdsi/2022/9780348231359,urn:procedure-editor:ActOfParliament:1339,,,SI,2022,"",gnQaHXQU
4597,North Yorkshire (Structural Changes) Order 2022,https://www.legislation.gov.uk/ukdsi/2022/9780348231380,urn:procedure-editor:ActOfParliament:1339,,,SI,2022,"",KEiuHh7k
4598,Somerset (Structural Changes) Order 2022,https://www.legislation.gov.uk/ukdsi/2022/9780348231366,urn:procedure-editor:ActOfParliament:1339,,,SI,2022,"",joNhXlxE
4599,Goods Vehicles (Licensing of Operators) (Amendment) Regulations 2022,https://www.legislation.gov.uk/ukdsi/2022/9780348231434,"urn:procedure-editor:ActOfParliament:353,urn:procedure-editor:ActOfParliament:1,urn:procedure-editor:ActOfParliament:12",,in accordance with regulation 2,SI,2022,"",zqpdrNU5
4604,"European Union (Withdrawal) Act 2018 (Repeal of EU Restrictions in Devolution Legislation, etc.) Regulations 2022",https://www.legislation.gov.uk/ukdsi/2022/9780348231342,urn:procedure-editor:ActOfParliament:1,2022-03-31,,SI,2022,"",e5SSVk9s
4607,Flood Reinsurance (Amendment) Regulations 2022,https://www.legislation.gov.uk/ukdsi/2022/9780348231489,urn:procedure-editor:ActOfParliament:1292,2022-04-01,,SI,2022,"",270U686P
4608,Civil Enforcement of Road Traffic Contraventions (Representations and Appeals) (England) Regulations 2022,https://www.legislation.gov.uk/ukdsi/2022/9780348231564,"urn:procedure-editor:ActOfParliament:938,urn:procedure-editor:ActOfParliament:1674",,in accordance with regulation 1(2),SI,2022,"",fOBJbt9E
