id,title,weblink,enabledby,comingintoforcedate,comingintoforcenote,prefix,year,precededbyproposedstatutoryinstrument,triplestoreid
1748,Banking Act 2009 (Service Providers to Payment Systems) Order 2017,https://www.legislation.gov.uk/ukdsi/2017/9780111159187,"urn:procedure-editor:ActOfParliament:1034,urn:procedure-editor:ActOfParliament:1282,urn:procedure-editor:ActOfParliament:25,urn:procedure-editor:ActOfParliament:862",,in accordance with article 1,SI,2017,"",diNZfB7G
1750,Misuse of Drugs Act 1971 (Amendment) (No. 2) Order 2017,https://www.legislation.gov.uk/ukdsi/2017/9780111159149/contents,urn:procedure-editor:ActOfParliament:2522,2017-11-27,,SI,2017,"",whMcvwCS
1751,Renewables Obligation (Amendment) (Energy Intensive Industries) Order 2017,https://www.legislation.gov.uk/ukdsi/2017/9780111159170,urn:procedure-editor:ActOfParliament:215,,Coming into force in accordance with article 1,SI,2017,"",vaeYCrHG
1753,Small Business Commissioner (Scope and Scheme) Regulations 2017,https://www.legislation.gov.uk/ukdsi/2017/9780111159217,urn:procedure-editor:ActOfParliament:882,,in accordance with regulation 1(2).,SI,2017,"",X1GnvvPb
1754,African Development Bank (Fourteenth Replenishment of the African Development Fund) Order 2017,https://www.legislation.gov.uk/ukdsi/2017/9780111158692,urn:procedure-editor:ActOfParliament:1307,,in accordance with Article 1,SI,2017,"",zqLhDxmd
1755,African Development Fund (Multilateral Debt Relief Initiative) (Amendment) Order 2017,https://www.legislation.gov.uk/ukdsi/2017/9780111158685,urn:procedure-editor:ActOfParliament:1307,,in accordance with Article 1.,SI,2017,"",LSd63bRr
1756,Asian Development Bank (Eleventh Replenishment of the Asian Development Fund) Order 2017,https://www.legislation.gov.uk/ukdsi/2017/9780111158708,urn:procedure-editor:ActOfParliament:1307,,in accordance with Article 1.,SI,2017,"",R6JZgwJJ
1757,Caribbean Development Bank (Ninth Replenishment of the Unified Special Development Fund) Order 2017,https://www.legislation.gov.uk/ukdsi/2017/9780111158784,urn:procedure-editor:ActOfParliament:1307,2017-11-29,,SI,2017,"",oJSHkqej
1758,International Development Association (Eighteenth Replenishment) Order 2017,https://www.legislation.gov.uk/ukdsi/2017/9780111158661,urn:procedure-editor:ActOfParliament:1307,2017-11-29,,SI,2017,"",27UhfLCL
1759,International Development Association (Multilateral Debt Relief Initiative) (Amendment) Order 2017,https://www.legislation.gov.uk/ukdsi/2017/9780111158678,urn:procedure-editor:ActOfParliament:1307,,in accordance with Article 1.,SI,2017,"",CwfIyOgz
1760,Scotland Act 2016 (Onshore Petroleum) (Consequential Amendments) Regulations 2017,https://www.legislation.gov.uk/ukdsi/2017/9780111159194,urn:procedure-editor:ActOfParliament:1336,,in accordance with regulation 1(2) and (3),SI,2017,"",mPL4Rfp7
1762,Allerdale (Electoral Changes) Order 2017,https://www.legislation.gov.uk/ukdsi/2017/9780111159040,urn:procedure-editor:ActOfParliament:949,,in accordance with article 1(2) and (3),SI,2017,"",7LxGwDHC
1763,Ashford (Electoral Changes) Order 2017,https://www.legislation.gov.uk/ukdsi/2017/9780111159033,urn:procedure-editor:ActOfParliament:949,,in accordance with article 1(2) and (3),SI,2017,"",OwqM30K3
1764,East Devon (Electoral Changes) Order 2017,https://www.legislation.gov.uk/ukdsi/2017/9780111159019,urn:procedure-editor:ActOfParliament:949,,in accordance with article 1(2) and (3),SI,2017,"",SaufX3Jl
1765,Horsham (Electoral Changes) Order 2017,https://www.legislation.gov.uk/ukdsi/2017/9780111159057,urn:procedure-editor:ActOfParliament:949,,in accordance with article 1(2) and (3),SI,2017,"",uv2V3yUO
1766,Manchester (Electoral Changes) Order 2017,https://www.legislation.gov.uk/ukdsi/2017/9780111159156,urn:procedure-editor:ActOfParliament:949,,in accordance with article 1(2) and (3),SI,2017,"",VLmu7Swc
1767,Newcastle-under-Lyme (Electoral Changes) Order 2017,https://www.legislation.gov.uk/ukdsi/2017/9780111159026,urn:procedure-editor:ActOfParliament:949,,in accordance with article 1(2) and (3),SI,2017,"",DXL2BVPv
1772,Greater Manchester Combined Authority (Public Health Functions) Order 2017,https://www.legislation.gov.uk/ukdsi/2017/9780111159132,urn:procedure-editor:ActOfParliament:949,, in accordance with article 1.,SI,2017,"",jGrWdKfQ
1782,Charitable Incorporated Organisations (Consequential Amendments) Order 2017,https://www.legislation.gov.uk/ukdsi/2017/9780111159880,urn:procedure-editor:ActOfParliament:38,2018-01-01,,SI,2017,"",EH2qHIcx
1788,Government Resources and Accounts Act 2000 (Audit of Public Bodies) Order 2017,https://www.legislation.gov.uk/ukdsi/2017/9780111159927,urn:procedure-editor:ActOfParliament:167,,Coming into force in accordance with article 1.,SI,2017,"",f0rL3OwM
1793,Scottish Banknote (Designation of Authorised Bank) Regulations 2017,https://www.legislation.gov.uk/ukdsi/2017/9780111160091,urn:procedure-editor:ActOfParliament:25,,in accordance with regulation 1,SI,2017,"",7Q3GGsS2
1794,"Small Business, Enterprise and Employment Act 2015 (Consequential Amendments, Savings and Transitional Provisions) Regulations 2017",https://www.legislation.gov.uk/ukdsi/2017/9780111153246,urn:procedure-editor:ActOfParliament:1330,,,SI,2017,"",dPNY9X6d
1799,Criminal Justice (Scotland) Act 2016 (Consequential Provisions) Order 2017,https://www.legislation.gov.uk/ukdsi/2017/9780111159866,urn:procedure-editor:ActOfParliament:1289,,in accordance with article 2.,SI,2017,"",9iAQBE8f
1801,Harborough (Electoral Changes) Order 2017,https://www.legislation.gov.uk/ukdsi/2017/9780111160053,urn:procedure-editor:ActOfParliament:949,,in accordance with article 1(2) and (3),SI,2017,"",tcDvaFE7
1802,London Borough of Croydon (Electoral Changes) Order 2017,https://www.legislation.gov.uk/ukdsi/2017/9780111160060,urn:procedure-editor:ActOfParliament:949,,in accordance with article 1(2) and (3),SI,2017,"",hAYqhQZQ
1803,South Lakeland (Electoral Changes) Order 2017,https://www.legislation.gov.uk/ukdsi/2017/9780111158623,urn:procedure-editor:ActOfParliament:949,,,SI,2017,"",Cjbx3Wu3
1804,Tendring (Electoral Changes) Order 2017,https://www.legislation.gov.uk/ukdsi/2017/9780111160077,urn:procedure-editor:ActOfParliament:949,,in accordance with article 1(2) and (3),SI,2017,"",DPYo8njg
1808,Double Taxation Relief and International Tax Enforcement (Colombia) Order 2017,https://www.legislation.gov.uk/ukdsi/2017/9780111160183,"urn:procedure-editor:ActOfParliament:338,urn:procedure-editor:ActOfParliament:1219",,,SI,2017,"",ns2XYxUV
1809,Double Taxation Relief and International Tax Enforcement (Lesotho) Order 2017,https://www.legislation.gov.uk/ukdsi/2017/9780111160251,"urn:procedure-editor:ActOfParliament:338,urn:procedure-editor:ActOfParliament:1219",,,SI,2017,"",jwUyG2xU
1810,Scotland Act 1998 (Insolvency Functions) Order 2017,https://www.legislation.gov.uk/ukdsi/2017/9780111160237,urn:procedure-editor:ActOfParliament:1289,,,SI,2017,"",XGyVay4r
1811,Scotland Act 1998 (Specification of Devolved Tax) (Wild Fisheries) Order 2017,https://www.legislation.gov.uk/ukdsi/2017/9780111160244,urn:procedure-editor:ActOfParliament:1289,,,SI,2017,"",TwbmTl6K
1812,Business Contract Terms (Assignment of Receivables) Regulations 2017,https://www.legislation.gov.uk/ukdsi/2017/9780111160305,urn:procedure-editor:ActOfParliament:1330,,,SI,2017,"",0YbqgW4z
1813,Regulation of Social Housing (Influence of Local Authorities) (England) Regulations 2017,https://www.legislation.gov.uk/ukdsi/2017/9780111160312,urn:procedure-editor:ActOfParliament:1026,,in accordance with regulation 1(1).,SI,2017,"",ywQI3ltM
1814,Selection of the President of Welsh Tribunals Regulations 2017,https://www.legislation.gov.uk/ukdsi/2017/9780111160299,urn:procedure-editor:ActOfParliament:1287,,in accordance with regulation 1(1).,SI,2017,"",d8LRhKye
1815,Community Drivers' Hours Offences (Enforcement) Regulations 2017,https://www.legislation.gov.uk/ukdsi/2017/9780111160022,"urn:procedure-editor:ActOfParliament:503,urn:procedure-editor:ActOfParliament:2419",,,SI,2017,"",vhSUhexy
1833,Risk Transformation Regulations 2017 ,https://www.legislation.gov.uk/ukdsi/2017/9780111160596,"urn:procedure-editor:ActOfParliament:2419,urn:procedure-editor:ActOfParliament:1282",, in accordance with regulation 1(2),SI,2017,"",dqHV7yhT
1834,Risk Transformation (Tax) Regulations 2017,https://www.legislation.gov.uk/ukdsi/2017/9780111160541,urn:procedure-editor:ActOfParliament:913,,in accordance with regulation 1(1),SI,2017,"",TcikrBSt
1835,Drug Dealing Telecommunications Restriction Orders Regulations 2017,https://www.legislation.gov.uk/ukdsi/2017/9780111160572,urn:procedure-editor:ActOfParliament:1143,, in accordance with regulation 1.,SI,2017,"",aweDwOZ2
1846,Designs (International Registration of Industrial Designs) Order 2017,https://www.legislation.gov.uk/ukdsi/2017/9780111160794,urn:procedure-editor:ActOfParliament:3994,,in accordance with article 1(2).,SI,2017,"",EqTrpht4
1847,Communications Act 2003 and the Digital Economy Act 2017 (Consequential Amendments to Primary Legislation) Regulations 2017,https://www.legislation.gov.uk/ukdsi/2017/9780111160787,"urn:procedure-editor:ActOfParliament:19,urn:procedure-editor:ActOfParliament:2",,in accordance with regulation 1(1) and (2).,SI,2017,"",BwTBq1fY
1848,Electronic Communications Code (Jurisdiction) Regulations 2017,https://www.legislation.gov.uk/ukdsi/2017/9780111160763,urn:procedure-editor:ActOfParliament:2,,in accordance with regulation 1(1).,SI,2017,"",ELiNncU1
1849,"Town and Country Planning (Fees for Applications, Deemed Applications, Requests and Site Visits) (England) (Amendment) Regulations 2017",https://www.legislation.gov.uk/ukdsi/2017/9780111160749,urn:procedure-editor:ActOfParliament:1047,,in accordance with regulation 1.,SI,2017,"",aTGnQWmC
1852,Terrorism Act 2000 (Code of Practice for Authorised Officers) Order 2018,https://www.legislation.gov.uk/ukdsi/2018/9780111160824,urn:procedure-editor:ActOfParliament:176,2018-01-31,,SI,2018,"",j19GQtIi
1853,Proceeds of Crime Act 2002 (Cash Searches: Code of Practice) Order 2018,https://www.legislation.gov.uk/ukdsi/2018/9780111160848,urn:procedure-editor:ActOfParliament:1358,2018-04-16,,SI,2018,"",MZrM7brv
1854,Criminal Finances Act 2017 (Consequential Amendment) Regulations 2018,https://www.legislation.gov.uk/ukdsi/2018/9780111160879,urn:procedure-editor:ActOfParliament:1359,2018-01-31,,SI,2018,"",QxtRJHw0
1855,Proceeds of Crime Act 2002 (Investigations: Code of Practice) Order 2018,https://www.legislation.gov.uk/ukdsi/2018/9780111160817,urn:procedure-editor:ActOfParliament:1358,2018-01-31,,SI,2018,"",1NpG2AwY
1856,Proceeds of Crime Act 2002 (Investigative Powers of Prosecutors: Code of Practice) Order 2018,https://www.legislation.gov.uk/ukdsi/2018/9780111160923,urn:procedure-editor:ActOfParliament:1358,2018-01-31,,SI,2018,"",32LyE1lf
1857,Proceeds of Crime Act 2002 (Recovery of Listed Assets: Code of Practice) (England and Wales and Scotland) Regulations 2018,https://www.legislation.gov.uk/ukdsi/2018/9780111160855,urn:procedure-editor:ActOfParliament:1358,2018-04-16,,SI,2018,"",JSIWkoEv
1858,"Proceeds of Crime Act 2002 (Search, Seizure and Detention of Property: Code of Practice) Order 2018",https://www.legislation.gov.uk/ukdsi/2018/9780111160831,urn:procedure-editor:ActOfParliament:1358,2018-01-31,,SI,2018,"",Rl3g7Dh8
1861,Blackburn with Darwen (Electoral Changes) Order 2017,https://www.legislation.gov.uk/ukdsi/2017/9780111160893,urn:procedure-editor:ActOfParliament:949,,"in accordance with article 1(2), (3) and (4)",SI,2017,"",TCbMiFYL
1862,Bolsover (Electoral Changes) Order 2017,https://www.legislation.gov.uk/ukdsi/2017/9780111160886,urn:procedure-editor:ActOfParliament:949,,in accordance with article 1(2) and (3),SI,2017,"",IIPmDGJQ
1863,North East Derbyshire (Electoral Changes) Order 2017,https://www.legislation.gov.uk/ukdsi/2017/9780111160909,urn:procedure-editor:ActOfParliament:949,,in accordance with article 1(2) and (3).,SI,2017,"",eyxKo2YY
1865,Ribble Valley (Electoral Changes) Order 2017,https://www.legislation.gov.uk/ukdsi/2017/9780111160930,urn:procedure-editor:ActOfParliament:949,,in accordance with article 1(2) and (3),SI,2017,"",RcYz2LdC
1866,Surrey Heath (Electoral Changes) Order 2017,https://www.legislation.gov.uk/ukdsi/2017/9780111160947,urn:procedure-editor:ActOfParliament:949,, in accordance with article 1(2) and (3),SI,2017,"",FSRDJDJH
1867,Kingston upon Hull (Electoral Changes) Order 2017,https://www.legislation.gov.uk/ukdsi/2017/9780111160985,urn:procedure-editor:ActOfParliament:949,,in accordance with article 1(2) and (3),SI,2017,"",PciiNJ2N
1885,Double Taxation Relief and International Tax Enforcement (Kyrgyzstan) Order 2017,https://www.legislation.gov.uk/ukdsi/2017/9780111161265,"urn:procedure-editor:ActOfParliament:338,urn:procedure-editor:ActOfParliament:1219",,,SI,2017,"",HWf8O7KR
1886,International Tax Enforcement (Bermuda) Order 2017,https://www.legislation.gov.uk/ukdsi/2017/9780111161258,urn:procedure-editor:ActOfParliament:338,,,SI,2017,"",dhHSmXjJ
1888,European Union (Definition of Treaties) (Partnership and Cooperation Agreement) (Turkmenistan) Order 2017,https://www.legislation.gov.uk/ukdsi/2017/9780111161296,urn:procedure-editor:ActOfParliament:2419,,in accordance with article 2.,SI,2017,"",AVdMGk2F
1889,European Union (Definition of Treaties) (Enhanced Partnership and Cooperation Agreement) (Kazakhstan) Order 2017,https://www.legislation.gov.uk/ukdsi/2017/9780111161289,urn:procedure-editor:ActOfParliament:2419,,in accordance with article 2.,SI,2017,"",qcZ7h44V
1896,Combined Authorities (Mayoral Elections) (Amendment) Order 2017,https://www.legislation.gov.uk/ukdsi/2017/9780111161531,urn:procedure-editor:ActOfParliament:949,,in accordance with article 1(2),SI,2017,"",Uc2cgBqZ
1897,Local Authorities (Mayoral Elections) (England and Wales) (Amendment) Regulations 2017,https://www.legislation.gov.uk/ukdsi/2017/9780111161548,urn:procedure-editor:ActOfParliament:928,,in accordance with regulation 1,SI,2017,"",v4zsILtn
1898,Pharmacy (Preparation and Dispensing Errors – Registered Pharmacies) Order 2018,https://www.legislation.gov.uk/ukdsi/2018/9780111161524,urn:procedure-editor:ActOfParliament:1270,,,SI,2018,"",1KYKLRLE
1904,Policing and Crime Act 2017 (Maritime Enforcement Powers: Code of Practice) Regulations 2017,https://www.legislation.gov.uk/ukdsi/2017/9780111161623,urn:procedure-editor:ActOfParliament:990,,in accordance with regulation 1,SI,2017,"",KRw8Yx9u
1905,Sub-national Transport Body (Transport for the North) Regulations 2017,https://www.legislation.gov.uk/ukdsi/2017/9780111161593,urn:procedure-editor:ActOfParliament:144,2018-04-01,,SI,2017,"",cWMycqbY
1909,Test Valley (Electoral Changes) Order 2018,https://www.legislation.gov.uk/ukdsi/2018/9780111161562,urn:procedure-editor:ActOfParliament:949,,in accordance with article 1(2) and (3),SI,2018,"",vHdMCm6e
1910,Tewkesbury (Electoral Changes) Order 2018,https://www.legislation.gov.uk/ukdsi/2018/9780111161579,urn:procedure-editor:ActOfParliament:949,,in accordance with article 1(2) and (3),SI,2018,"",K8vgFKK7
1913,European Parliamentary Elections Act 2002 (Amendment) Regulations 2017,https://www.legislation.gov.uk/ukdsi/2017/9780111161791,urn:procedure-editor:ActOfParliament:757,,,SI,2017,"",pCKsZ2bR
1914,European Parliamentary Elections (Amendment) Regulations 2017,https://www.legislation.gov.uk/ukdsi/2017/9780111161784,"urn:procedure-editor:ActOfParliament:784,urn:procedure-editor:ActOfParliament:2419,urn:procedure-editor:ActOfParliament:757",,,SI,2017,"",WBLNlsMr
1921,Transparency of Donations and Loans etc. (Northern Ireland Political Parties) Order 2018,https://www.legislation.gov.uk/ukdsi/2018/9780111162019,"urn:procedure-editor:ActOfParliament:77,urn:procedure-editor:ActOfParliament:1052,urn:procedure-editor:ActOfParliament:600",,in accordance with Article 1(2) and (3),SI,2018,"",eTIM83rU
1926,Environmental Protection (Microbeads) (England) Regulations 2017,https://www.legislation.gov.uk/ukdsi/2017/9780111162118,"urn:procedure-editor:ActOfParliament:1230,urn:procedure-editor:ActOfParliament:165",,in accordance with regulation 1,SI,2017,"",oJUjJfqs
1938,Armed Forces Act 2006 (Amendment of Schedule 2) Order 2017,https://www.legislation.gov.uk/ukdsi/2017/9780111162026,urn:procedure-editor:ActOfParliament:1366,2018-03-01,,SI,2017,"",Hpam1JAJ
1939,Housing and Planning Act 2016 (Banning Order Offences) Regulations 2017,https://www.legislation.gov.uk/ukdsi/2017/9780111162224,urn:procedure-editor:ActOfParliament:1026,,,SI,2017,"",EyQkh7ze
1940,Judicial Pensions (Fee-Paid Judges) (Amendment) Regulations 2017,https://www.legislation.gov.uk/ukdsi/2017/9780111162187,urn:procedure-editor:ActOfParliament:869,,,SI,2017,"",E0rsMnxJ
1961,Co-operative and Community Benefit Societies Act 2014 (Amendments to Audit Requirements) Order 2017,https://www.legislation.gov.uk/ukdsi/2017/9780111162491,urn:procedure-editor:ActOfParliament:1283,2018-04-06,,SI,2017,"",HN7TkCqm
1962,Higher Education (Access and Participation Plans) (England) Regulations 2018,https://www.legislation.gov.uk/ukdsi/2018/9780111162422,urn:procedure-editor:ActOfParliament:20,,in accordance with regulation 1,SI,2018,"",hncq61IU
1974,"Small Business, Enterprise and Employment Act 2015 (Consequential Amendments, Savings and Transitional Provisions) Regulations 2017",https://www.legislation.gov.uk/ukdsi/2017/9780111162675,urn:procedure-editor:ActOfParliament:1330,,in accordance with regulation 1(2) and (3),SI,2017,"",T5d1vqnx
1977,"Transfer of Responsibility for Relevant Children (Extension to Wales, Scotland and Northern Ireland) Regulations 2017",https://www.legislation.gov.uk/ukdsi/2017/9780111162750,urn:procedure-editor:ActOfParliament:1301,,in accordance with regulation 1,SI,2017,"",YWniJAtP
1992,European Parliamentary Elections (Amendment) Regulations 2018,https://www.legislation.gov.uk/ukdsi/2018/9780111163016,"urn:procedure-editor:ActOfParliament:757,urn:procedure-editor:ActOfParliament:784",,in accordance with regulation 1(2),SI,2018,"",rDKZDNId
1993,European Parliamentary Elections Act 2002 (Amendment) Regulations 2018,https://www.legislation.gov.uk/ukdsi/2018/9780111163009,urn:procedure-editor:ActOfParliament:757,, in accordance with regulation 1(2).,SI,2018,"",pLxFWqAd
1994,Help-to-Save Accounts Regulations 2018,https://www.legislation.gov.uk/ukdsi/2018/9780111162880,urn:procedure-editor:ActOfParliament:997,,in accordance with Regulation 1.,SI,2018,"",E3aiSLjA
2003,Community Infrastructure Levy (Amendment) Regulations 2018,https://www.legislation.gov.uk/ukdsi/2018/9780111163030,urn:procedure-editor:ActOfParliament:946,,in accordance with regulation 1.,SI,2018,"",oNAl1hvW
2008,Gambling Act 2005 (Amendment of Schedule 6) Order 2018,https://www.legislation.gov.uk/ukdsi/2018/9780111163245,urn:procedure-editor:ActOfParliament:1355,,in accordance with article 1,SI,2018,"",50gPauGu
2019,Human Fertilisation and Embryology (Amendment) Regulations 2018,https://www.legislation.gov.uk/ukdsi/2018/9780111163443,urn:procedure-editor:ActOfParliament:2419,,01/04/2018 for all purposes other than regulation 1(3),SI,2018,"",98KLcjTv
2020,Human Tissue (Quality and Safety for Human Application) (Amendment) Regulations 2018,https://www.legislation.gov.uk/ukdsi/2018/9780111163450,urn:procedure-editor:ActOfParliament:2419,,01/04/2018 for all purposes other than regulation 1(3),SI,2018,"",fyHOgvh5
2021,Investigatory Powers (Codes of Practice) Regulations 2018,https://www.legislation.gov.uk/ukdsi/2018/9780111163627,urn:procedure-editor:ActOfParliament:1334,,in accordance with regulation 1,SI,2018,"",6Kr1I0Nu
2022,Investigatory Powers (Interception by Businesses etc. for Monitoring and Record-keeping Purposes) Regulations 2018,https://www.legislation.gov.uk/ukdsi/2018/9780111163603,urn:procedure-editor:ActOfParliament:1334,,in accordance with regulation 1,SI,2018,"",Z4FEY46k
2023,Investigatory Powers (Review of Notices and Technical Advisory Board) Regulations 2018,https://www.legislation.gov.uk/ukdsi/2018/9780111163597,urn:procedure-editor:ActOfParliament:1334,,in accordance with regulation 1(2) and (3),SI,2018,"",BRisPO3d
2024,Investigatory Powers (Technical Capability) Regulations 2018,https://www.legislation.gov.uk/ukdsi/2018/9780111163610,urn:procedure-editor:ActOfParliament:1334,,in accordance with regulation 1,SI,2018,"",8e7mDI9l
2025,Terrorism Act 2000 (Proscribed Organisations) (Amendment) Order 2017,https://www.legislation.gov.uk/ukdsi/2017/9780111163504,urn:procedure-editor:ActOfParliament:176,,in accordance with article 1(1),SI,2017,"",hTPxqHkt
2026,Financial Assistance Scheme (Increased Cap for Long Service) Regulations 2018,https://www.legislation.gov.uk/ukdsi/2018/9780111163542,urn:procedure-editor:ActOfParliament:1061,,in accordance with regulation 1,SI,2018,"",5NM5orTM
2036,Financial Services Act 2012 (Mutual Societies) Order 2018,https://www.legislation.gov.uk/ukdsi/2018/9780111163689,urn:procedure-editor:ActOfParliament:1214,2018-04-06,,SI,2018,"",S96rRgP0
2037,Legal Services Act 2007 (General Council of the Bar) (Modification of Functions) Order 2018,https://www.legislation.gov.uk/ukdsi/2018/9780111163702,urn:procedure-editor:ActOfParliament:847,,in accordance with article 1,SI,2018,"",lfpVT0jj
2038,Legal Services Act 2007 (Appeals from Licensing Authority Decisions) (General Council of the Bar) Order 2018,https://www.legislation.gov.uk/ukdsi/2018/9780111163719,urn:procedure-editor:ActOfParliament:847,,in accordance with article 1,SI,2018,"",tVj2JmpI
2039,Representation of the People (England and Wales) (Amendment) Regulations 2018,https://www.legislation.gov.uk/ukdsi/2018/9780111163696,"urn:procedure-editor:ActOfParliament:1718,urn:procedure-editor:ActOfParliament:1052",,in accordance with regulation 1.,SI,2018,"",Xi6LgvGS
2041,Representation of the People (Northern Ireland) (Amendment) Regulations 2018,https://www.legislation.gov.uk/ukdsi/2018/9780111163665,"urn:procedure-editor:ActOfParliament:1052,urn:procedure-editor:ActOfParliament:1718",,in accordance with regulation 1(2),SI,2018,"",e7k0eFag
2042,Representation of the People (Scotland) (Amendment) Regulations 2018,https://www.legislation.gov.uk/ukdsi/2018/9780111163634,"urn:procedure-editor:ActOfParliament:1052,urn:procedure-editor:ActOfParliament:1718",,in accordance with regulation 1,SI,2018,"",ISKoFZze
2051,Building Societies (Restricted Transactions) (Amendment to the Prohibition on Entering into Derivatives Transactions) Order 2018,https://www.legislation.gov.uk/ukdsi/2018/9780111163740,urn:procedure-editor:ActOfParliament:1529,2018-04-06,,SI,2018,"",Gj3QqYvA
2062,Littering From Vehicles Outside London (Keepers: Civil Penalties) Regulations 2018,https://www.legislation.gov.uk/ukdsi/2018/9780111163818,urn:procedure-editor:ActOfParliament:165,2018-04-01,,SI,2018,"",3j3Ms9TZ
2063,Financial Services and Markets Act 2000 (Carrying on Regulated Activities by Way of Business) (Amendment) Order 2018,https://www.legislation.gov.uk/ukdsi/2018/9780111163832,urn:procedure-editor:ActOfParliament:1282,,in accordance with article 1.,SI,2018,"",S1j4tidU
2064,Non-Domestic Rating (Alteration of Lists and Appeals) (England) (Amendment) Regulations 2018,https://www.legislation.gov.uk/ukdsi/2018/9780111163870,urn:procedure-editor:ActOfParliament:397,, in accordance with regulation 1(2).,SI,2018,"",FkEWlR8S
2098,Policing and Crime Act 2017 (Consequential Amendments) Regulations 2018,https://www.legislation.gov.uk/ukdsi/2018/9780111164143,urn:procedure-editor:ActOfParliament:990,,in accordance with regulation 1.,SI,2018,"",WktXMvE0
2099,Immigration and Nationality (Fees) (Amendment) Order 2018,https://www.legislation.gov.uk/ukdsi/2018/9780111164167,urn:procedure-editor:ActOfParliament:1300,,in accordance with article 1.,SI,2018,"",8GFwA403
2104,Enactment of Extra-Statutory Concessions Order 2018,https://www.legislation.gov.uk/ukdsi/2018/9780111164365,urn:procedure-editor:ActOfParliament:72,2018-04-06,,SI,2018,"",aFV6jX7K
2105,Guaranteed Minimum Pensions Increase Order 2018,https://www.legislation.gov.uk/ukdsi/2018/9780111164310,urn:procedure-editor:ActOfParliament:452,2018-04-06,,SI,2018,"",ASRFDPoZ
2106,Mesothelioma Lump Sum Payments (Conditions and Amounts) (Amendment) Regulations 2018,https://www.legislation.gov.uk/ukdsi/2018/9780111164280,urn:procedure-editor:ActOfParliament:79,2018-04-01,,SI,2018,"",n0Kq0k9l
2107,Pneumoconiosis etc. (Workers' Compensation) (Payment of Claims) (Amendment) Regulations 2018,https://www.legislation.gov.uk/ukdsi/2018/9780111164235,urn:procedure-editor:ActOfParliament:1944,2018-04-01,,SI,2018,"",YU04okw2
2108,Social Security Benefits Up-rating Order 2018,https://www.legislation.gov.uk/ukdsi/2018/9780111164327,urn:procedure-editor:ActOfParliament:528,,in accordance with article 1(2) and (3).,SI,2018,"",ZfkCfOkU
2109,"Social Security (Contributions) (Rates, Limits and Thresholds Amendments and National Insurance Funds Payments) Regulations 2018",https://www.legislation.gov.uk/ukdsi/2018/9780111164358,"urn:procedure-editor:ActOfParliament:589,urn:procedure-editor:ActOfParliament:528,urn:procedure-editor:ActOfParliament:527,urn:procedure-editor:ActOfParliament:529,urn:procedure-editor:ActOfParliament:286",2018-04-06,,SI,2018,"",QQSrMx4E
2110,Tax Credits and Guardian's Allowance Up-rating etc. Regulations 2018,https://www.legislation.gov.uk/ukdsi/2018/9780111164389,"urn:procedure-editor:ActOfParliament:528,urn:procedure-editor:ActOfParliament:527,urn:procedure-editor:ActOfParliament:795",,in accordance with regulation 1(2).,SI,2019,"",QGjYHakf
2111,Soft Drinks Industry Levy (Enforcement) Regulations 2018,https://www.legislation.gov.uk/ukdsi/2018/9780111164372,urn:procedure-editor:ActOfParliament:1028,2018-04-06,,SI,2018,"",vX2fetNn
