id,title,weblink,enabledby,comingintoforcedate,comingintoforcenote,prefix,year,precededbyproposedstatutoryinstrument,triplestoreid
5890,Wokingham (Electoral Changes) Order 2023,https://www.legislation.gov.uk/ukdsi/2023/9780348251487,urn:procedure-editor:ActOfParliament:949,,"in accordance with article 1(2), (3), (4) and (5)",SI,2023,"",lVBLhYhz
5891,Greenhouse Gas Emissions Trading Scheme Auctioning (Amendment) Regulations 2023,https://www.legislation.gov.uk/uksi/2023/994/made,urn:procedure-editor:ActOfParliament:1314,, in accordance with regulation 1(2) and (3),SI,2023,"",UQ7IFHCM
5893,National Minimum Wage (Amendment) (No. 2) Regulations 2023,https://www.legislation.gov.uk/ukdsi/2023/9780348251548,urn:procedure-editor:ActOfParliament:427,2024-04-01,,SI,2023,"",M606zdYo
5895,Immigration (Age Assessments) Regulations 2023,https://www.legislation.gov.uk/ukdsi/2023/9780348251593,urn:procedure-editor:ActOfParliament:6939,,,SI,2023,"",fa2tj3Bs
5901,Occupational Pension Schemes (Amendment) (Equal Treatment) (Northern Ireland) Regulations 2023,https://www.legislation.gov.uk/ukdsi/2023/9780348251739,urn:procedure-editor:ActOfParliament:17808,,in accordance with regulation 1(2),SI,2023,"",WgkLfhJ3
5902,Pensions (Pension Protection Fund Compensation) (Northern Ireland) Regulations 2023,https://www.legislation.gov.uk/ukdsi/2023/9780348251753,urn:procedure-editor:ActOfParliament:17808,,in accordance with regulation 1(2),SI,2023,"",CXRPDHvy
5903,Pensions Act 2004 and the Equality Act 2010 (Amendment) (Equal Treatment by Occupational Pension Schemes) Regulations 2023,https://www.legislation.gov.uk/ukdsi/2023/9780348251777,urn:procedure-editor:ActOfParliament:17808,,in accordance with regulation 1(b),SI,2023,"",R8sE5oDu
5909,Pensions Act 2004 (Amendment) (Pension Protection Fund Compensation) Regulations 2023,https://www.legislation.gov.uk/ukdsi/2023/9780348251746,urn:procedure-editor:ActOfParliament:17808,,in accordance with regulation 1(b),SI,2023,"",aGc5F20q
5910,Greenhouse Gas Emissions Trading Scheme (Amendment) (No. 2) Order 2023,https://www.legislation.gov.uk/ukdsi/2023/9780348251876,urn:procedure-editor:ActOfParliament:1350,,,SI,2023,"",xFY6BrAw
5911,Digital Government (Disclosure of Information) (Identity Verification Services) Regulations 2023,https://www.legislation.gov.uk/ukdsi/2023/9780348251661,urn:procedure-editor:ActOfParliament:19,,,SI,2023,"",bsFKL3cs
5932,Aviation (Consumers) (Amendment) Regulations 2023,https://www.legislation.gov.uk/ukdsi/2023/9780348252187,urn:procedure-editor:ActOfParliament:17808,,,SI,2023,"",M3fDXG5w
5933,Public Service Obligations in Transport Regulations 2023,https://www.legislation.gov.uk/ukdsi/2023/9780348252217,urn:procedure-editor:ActOfParliament:17808,2023-12-25,,SI,2023,"",gYFwDPuH
5937,"Design Right, Artist's Resale Right and Copyright (Amendment) Regulations 2023",https://www.legislation.gov.uk/ukdsi/2023/9780348252316,urn:procedure-editor:ActOfParliament:17808,,,SI,2023,"",ctyB7JZo
5938,Intellectual Property (Exhaustion of Rights) (Amendment) Regulations 2023,https://www.legislation.gov.uk/ukdsi/2023/9780348252309,urn:procedure-editor:ActOfParliament:17808,,In accordance with regulation 1(b) ,SI,2023,"",DCm8NjTV
5939,Vehicle Emissions Trading Schemes Order 2023,https://www.legislation.gov.uk/ukdsi/2023/9780348252453,urn:procedure-editor:ActOfParliament:1350,,In accordance with article 1.,SI,2023,"",kXocb5QC
5940,Carer's Assistance (Carer Support Payment) (Scotland) Regulations 2023 (Consequential Modifications) Order 2023,https://www.legislation.gov.uk/ukdsi/2023/9780348252439,urn:procedure-editor:ActOfParliament:1289,,In accordance with article 1(2),SI,2023,"",rPBGCYpP
5941,Green Gas Support Scheme (Amendment) Regulations 2023,https://www.legislation.gov.uk/ukdsi/2023/9780348252507,urn:procedure-editor:ActOfParliament:662,,,SI,2023,"",A9TUkufW
5943,Financial Services and Markets Act 2023 (Resolution of Central Counterparties: Partial Property Transfers and Safeguarding of Protected Arrangements) Regulations 2023,https://www.legislation.gov.uk/ukdsi/2023/9780348252330,"urn:procedure-editor:ActOfParliament:17810,urn:procedure-editor:ActOfParliament:25",2023-12-31,,SI,2023,"",IvGu8QKn
5944,Resolution of Central Counterparties (Modified Application of Corporate Law and Consequential Amendments) Regulations 2023,https://www.legislation.gov.uk/ukdsi/2023/9780348252347,urn:procedure-editor:ActOfParliament:17810,2023-12-31,,SI,2023,"",VJA1BMxe
5945,Counter-Terrorism and Border Security Act 2019 (Port Examination Code of Practice) Regulations 2023,https://www.legislation.gov.uk/ukdsi/2023/9780348252408,urn:procedure-editor:ActOfParliament:1070,2023-12-20,,SI,2023,"",bj55ckV2
5946,National Security Act 2023 (Consequential Amendments of Primary Legislation) Regulations 2023,https://www.legislation.gov.uk/ukdsi/2023/9780348252491,urn:procedure-editor:ActOfParliament:17824,2023-12-20,,SI,2023,"",EEVXCISx
5947,"Police and Criminal Evidence Act 1984 (Codes of Practice) (Revision of Codes A, B, C, D and H and New Code I) Order 2023",https://www.legislation.gov.uk/ukdsi/2023/9780348252385,urn:procedure-editor:ActOfParliament:1654,2023-12-20,,SI,2023,"",TMl7LMRI
5948,Criminal Justice Act 2003 (Removal of Prisoners for Deportation) Order 2023,https://www.legislation.gov.uk/ukdsi/2023/9780348252521,urn:procedure-editor:ActOfParliament:842,2024-01-16,,SI,2023,"",tCnol2UH
5949,"Health Protection (Coronavirus, Testing Requirements and Standards) (England) (Amendment and Transitional Provision) Regulations 2023",https://www.legislation.gov.uk/ukdsi/2023/9780348252484,urn:procedure-editor:ActOfParliament:1669,2024-01-01,,SI,2023,"",URWUKMwM
5950,Retained EU Law (Revocation and Reform) Act 2023 (Consequential Amendment) Regulations 2023,https://www.legislation.gov.uk/ukdsi/2023/9780348252415,urn:procedure-editor:ActOfParliament:17808,2024-01-01,,SI,2023,"",fqD3an5r
5951,National Security Act 2023 (Video Recording with Sound of Interviews and Associated Code of Practice) Regulations 2023,https://www.legislation.gov.uk/ukdsi/2023/9780348252378,urn:procedure-editor:ActOfParliament:17824,2023-12-20,,SI,2023,"",34nKSwl5
5952,Higher-Risk Buildings (Keeping and Provision of Information etc.) (England) Regulations 2023,https://www.legislation.gov.uk/ukdsi/2023/9780348252323,urn:procedure-editor:ActOfParliament:1650,,In accordance with regulation 1(1),SI,2023,"",wQan443I
5953,Recognition of Professional Qualifications and Implementation of International Recognition Agreements (Amendment) Regulations 2023,https://www.legislation.gov.uk/ukdsi/2023/9780348252552,urn:procedure-editor:ActOfParliament:6925,,,SI,2023,"",4oB1m7hi
5954,Stockton-on-Tees (Electoral Changes) Order 2023,https://www.legislation.gov.uk/ukdsi/2023/9780348252514,urn:procedure-editor:ActOfParliament:949,,In accordance with article 1(2) and (3),SI,2023,"",fiCy4SCd
5955,Investigatory Powers Act 2016 (Remedial) Order 2023,https://www.legislation.gov.uk/ukdsi/2023/9780348252446,urn:procedure-editor:ActOfParliament:1324,,,SI,2023,urn:procedure-editor:ProposedDraftRemedialOrder:5561,m7jEoxB8
5959,Health Care Services (Provider Selection Regime) Regulations 2023,https://www.legislation.gov.uk/ukdsi/2023/9780348252613,urn:procedure-editor:ActOfParliament:1178,2024-01-01,,SI,2023,"",qqtsZn1q
5960,Immigration (Health Charge) (Amendment) Order 2023,https://www.legislation.gov.uk/ukdsi/2023/9780348252637,urn:procedure-editor:ActOfParliament:1300,,In accordance with article 1(2),SI,2023,"",Oj1daRX3
5962,Sentencing Act 2020 (Amendment of Schedule 21) Regulations 2023,https://www.legislation.gov.uk/ukdsi/2023/9780348252682,urn:procedure-editor:ActOfParliament:7,,,SI,2023,"",pPLk3F1x
5963,Major Sporting Events (Income Tax Exemption) (World Athletics Indoor Championships Glasgow 24) Regulations 2023,https://www.legislation.gov.uk/ukdsi/2023/9780348252644,urn:procedure-editor:ActOfParliament:1191,2024-02-22,,SI,2023,"",erDNVM3Y
5964,Legal Services Act 2007 (Approved Regulator) Order 2023,https://www.legislation.gov.uk/ukdsi/2023/9780348252699,urn:procedure-editor:ActOfParliament:847,,,SI,2023,"",LcGjGMce
5965,Representation of the People (Overseas Electors etc.) (Amendment) Regulations 2023,https://www.legislation.gov.uk/ukdsi/2023/9780348252675,"urn:procedure-editor:ActOfParliament:1209,urn:procedure-editor:ActOfParliament:6940,urn:procedure-editor:ActOfParliament:61,urn:procedure-editor:ActOfParliament:1718",,In accordance with regulation 1(2) to (5) ,SI,2023,"",NtoNQlvd
5966,Representation of the People (Overseas Electors etc.) (Amendment) (Northern Ireland) Regulations 2023,https://www.legislation.gov.uk/ukdsi/2023/9780348252729,"urn:procedure-editor:ActOfParliament:1718,urn:procedure-editor:ActOfParliament:1209,urn:procedure-editor:ActOfParliament:61,urn:procedure-editor:ActOfParliament:1351",2024-01-16,,SI,2023,"",Y46EaJXB
5967,Plant Protection Products (Miscellaneous Amendments) Regulations 2023,https://www.legislation.gov.uk/ukdsi/2023/9780348252651,urn:procedure-editor:ActOfParliament:17808,2023-12-31,,SI,2023,"",9qbFNAaf
5973,Payment and Electronic Money Institution Insolvency (Amendment) Regulations 2023,https://www.legislation.gov.uk/ukdsi/2023/9780348252859,urn:procedure-editor:ActOfParliament:25,,,SI,2023,"",G2I7LED8
5974,Wine (Revocation and Consequential Provision) Regulations 2023,https://www.legislation.gov.uk/ukdsi/2023/9780348252903,urn:procedure-editor:ActOfParliament:17808,2024-01-01,,SI,2023,"",bX4dFA3z
5979,Plant Health etc. (Miscellaneous Fees) (Amendment) (England) Regulations 2023,https://www.legislation.gov.uk/ukdsi/2023/9780348252873,urn:procedure-editor:ActOfParliament:1,2023-12-30,,SI,2023,"",Mwywlp1Y
6000,Financial Services and Markets Act 2023 (Benchmarks and Capital Requirements) (Amendment) Regulations 2023,https://www.legislation.gov.uk/ukdsi/2023/9780348253313,urn:procedure-editor:ActOfParliament:17810,,In accordance with regulation 1,SI,2023,"",vUHbooqZ
6001,Financial Services and Markets Act 2000 (Financial Promotion) (Amendment) (No. 2) Order 2023,https://www.legislation.gov.uk/ukdsi/2023/9780348253245,urn:procedure-editor:ActOfParliament:17810,2024-01-31,,SI,2023,"",XLIZ7d9L
6002,Data Protection (Fundamental Rights and Freedoms) (Amendment) Regulations 2023,https://www.legislation.gov.uk/ukdsi/2023/9780348253139,urn:procedure-editor:ActOfParliament:17808,,In accordance with regulation 1(2),SI,2023,urn:procedure-editor:ProposedNegativeStatutoryInstrument:5883,SVQzTF08
6003,Equality Act 2010 (Amendment) Regulations 2023,https://www.legislation.gov.uk/ukdsi/2023/9780348253191,urn:procedure-editor:ActOfParliament:17808,2024-01-01,,SI,2023,"",nPb4tBY9
6004,Strikes (Minimum Service Levels: Border Security) Regulations 2023,https://www.legislation.gov.uk/ukdsi/2023/9780348253337,urn:procedure-editor:ActOfParliament:555,,In accordance with regulation 1(2),SI,2023,"",51IMBeZ9
6005,Strikes (Minimum Service Levels: Passenger Railway Services) Regulations 2023,https://www.legislation.gov.uk/ukdsi/2023/9780348253368,urn:procedure-editor:ActOfParliament:555,,In accordance with regulation 1(2),SI,2023,"",EMa3vtq5
6006,Agriculture (Delinked Payments and Consequential Provisions) (England) Regulations 2023,https://www.legislation.gov.uk/ukdsi/2023/9780348253344,urn:procedure-editor:ActOfParliament:10,2024-01-01,,SI,2023,"",XZcR4sgS
6007,Financial Services and Markets Act 2023 (Consequential Amendments) Regulations 2023,https://www.legislation.gov.uk/ukdsi/2023/9780348253238,urn:procedure-editor:ActOfParliament:17810,2024-01-01,,SI,2023,"",BpOijzDu
6008,York and North Yorkshire Combined Authority Order 2023,https://www.legislation.gov.uk/ukdsi/2023/9780348253252,urn:procedure-editor:ActOfParliament:949,,In accordance with article 1,SI,2023,"",kFRDBLB9
6009,Strikes (Minimum Service Levels: NHS Ambulance Services and the NHS Patient Transport Service) Regulations 2023,https://www.legislation.gov.uk/ukdsi/2023/9780348253320,urn:procedure-editor:ActOfParliament:555,,In accordance with regulation 1(2),SI,2023,"",69XAQj0g
6011,"Employment Rights (Amendment, Revocation and Transitional Provision) Regulations 2023",https://www.legislation.gov.uk/ukdsi/2023/9780348253269,"urn:procedure-editor:ActOfParliament:17808,urn:procedure-editor:ActOfParliament:244",2024-01-01,,SI,2023,"",LUddFpC5
6015,Rossendale (Electoral Changes) Order 2024,https://www.legislation.gov.uk/ukdsi/2024/9780348253290,urn:procedure-editor:ActOfParliament:949,,in accordance with article 1(2) and (3),SI,2024,"",tXFu3fhA
6016,Nuneaton & Bedworth (Electoral Changes) Order 2024,https://www.legislation.gov.uk/ukdsi/2024/9780348253306,urn:procedure-editor:ActOfParliament:949,,in accordance with article 1(2) and (3),SI,2024,"",ijzKe3vf
6017,Tunbridge Wells (Electoral Changes) Order 2024,https://www.legislation.gov.uk/ukdsi/2024/9780348253283,urn:procedure-editor:ActOfParliament:949,,"in accordance with article 1(2), (3) and (4)",SI,2024,"",bktE1Dl7
6018,"Hydrogen Production Revenue Support (Directions, Eligibility and Counterparty) Regulations 2023",https://www.legislation.gov.uk/ukdsi/2023/9780348253474,urn:procedure-editor:ActOfParliament:18398,,,SI,2023,"",6Y08eUaB
6019,"Nationality, Immigration and Asylum Act 2002 (Amendment of List of Safe States) Regulations 2024",https://www.legislation.gov.uk/ukdsi/2024/9780348253481,urn:procedure-editor:ActOfParliament:789,,in accordance with regulation 1(2),SI,2024,"",dX9dSKyD
6023,Higher-Risk Buildings (Keeping and Provision of Information etc.) (England) Regulations 2023,https://www.legislation.gov.uk/ukdsi/2023/9780348253504,"urn:procedure-editor:ActOfParliament:6933,urn:procedure-editor:ActOfParliament:1650",,In accordance with regulation 1(1),SI,2023,"",IZr5tYbj
6026,Trade Union (Deduction of Union Subscriptions from Wages in the Public Sector) Regulations 2023,https://www.legislation.gov.uk/ukdsi/2023/9780348253405,urn:procedure-editor:ActOfParliament:555,2024-05-09,,SI,2023,"",RaUECEUe
6037,Child Support (Management of Payments and Arrears and Fees) (Amendment) Regulations 2023,https://www.legislation.gov.uk/ukdsi/2023/9780348253641,"urn:procedure-editor:ActOfParliament:79,urn:procedure-editor:ActOfParliament:308",2024-02-26,,SI,2023,"",vtkUpnUE
6038,Judicial Pensions (Remediable Service etc.) (Amendment) Regulations 2023,https://www.legislation.gov.uk/ukdsi/2023/9780348253658,"urn:procedure-editor:ActOfParliament:1408,urn:procedure-editor:ActOfParliament:1315",,In accordance with regulation 1(b),SI,2023,"",aZlDZGcT
6039,Medical Devices (In Vitro Diagnostic Devices etc.) (Amendment) Regulations 2023,https://www.legislation.gov.uk/ukdsi/2023/9780348253696,urn:procedure-editor:ActOfParliament:1,,In accordance with regulation 1(2),SI,2023,"",glOkGqiF
6040,Employment Tribunals and Employment Appeal Tribunal (Composition of Tribunal) Regulations 2023,https://www.legislation.gov.uk/ukdsi/2023/9780348253689,urn:procedure-editor:ActOfParliament:877,,In accordance with regulation 1(1),SI,2023,"",lE2SvokG
6042,Immigration (Employment of Adults Subject to Immigration Control) (Maximum Penalty) (Amendment) Order 2023,https://www.legislation.gov.uk/ukdsi/2023/9780348253719,urn:procedure-editor:ActOfParliament:1238,,In accordance with article 1(2),SI,2023,"",vhuHtbv9
6043,Immigration Act 2014 (Residential Accommodation) (Maximum Penalty) Order 2023,https://www.legislation.gov.uk/ukdsi/2023/9780348253726,urn:procedure-editor:ActOfParliament:1300,,In accordance with article 1(2),SI,2023,"",ERBjXNu1
6055,West Northamptonshire (Electoral Changes) Order 2024,https://www.legislation.gov.uk/ukdsi/2024/9780348253610,urn:procedure-editor:ActOfParliament:949,,In accordance with article 1(2) and (3),SI,2024,"",xv2DWuUr
6073,Public Offers and Admissions to Trading Regulations 2023,https://www.legislation.gov.uk/ukdsi/2023/9780348254235,urn:procedure-editor:ActOfParliament:1282,,,SI,2023,"",1bWMwIVT
6076,Misuse of Drugs Act 1971 (Amendment) Order 2024,https://www.legislation.gov.uk/ukdsi/2024/9780348254105,urn:procedure-editor:ActOfParliament:2522,,,SI,2024,"",dYhhUAsd
6077,Data Reporting Services Regulations 2023,https://www.legislation.gov.uk/ukdsi/2023/9780348254273,urn:procedure-editor:ActOfParliament:17810,,In accordance with regulation 1,SI,2023,"",VLRd2eTB
6078,Securitisation Regulations 2023,https://www.legislation.gov.uk/ukdsi/2023/9780348254242,"urn:procedure-editor:ActOfParliament:1282,urn:procedure-editor:ActOfParliament:17810",,In accordance with regulation 2,SI,2023,"",CBreRTfz
6080,Online Safety (List of Overseas Regulators) Regulations 2024,https://www.legislation.gov.uk/ukdsi/2024/9780348254068,urn:procedure-editor:ActOfParliament:18393,,In accordance with regulation 1(1),SI,2024,"",pnLEV6ja
6081,"General Aviation (Persons on Board, Flight Information and Civil Penalties) Regulations 2024",https://www.legislation.gov.uk/ukdsi/2024/9780348254365,"urn:procedure-editor:ActOfParliament:2565,urn:procedure-editor:ActOfParliament:1238",2024-04-06,,SI,2024,"",v5t5XNgM
6086,Biodiversity Gain Site Register (Financial Penalties and Fees) Regulations 2024,https://www.legislation.gov.uk/ukdsi/2024/9780348254358,urn:procedure-editor:ActOfParliament:1395,,In accordance with regulation 1(2),SI,2024,"",gqQ2bjR0
6087,Biodiversity Gain (Town and Country Planning) (Consequential Amendments) Regulations 2024,https://www.legislation.gov.uk/ukdsi/2024/9780348254419,urn:procedure-editor:ActOfParliament:1395,,In accordance with regulation 1(2),SI,2024,"",zbdvSywt
6090,Wine (Amendment) (England) Regulations 2024,https://www.legislation.gov.uk/ukdsi/2024/9780348254525,urn:procedure-editor:ActOfParliament:10,2024-07-15,,SI,2024,"",vCP6UxGh
6091,Magistrates’ Courts Act 1980 (Automatic Online Conviction and Standard Statutory Penalty) (Specification of Offences and Penalties) Regulations 2024,https://www.legislation.gov.uk/ukdsi/2024/9780348254549,urn:procedure-editor:ActOfParliament:1917,,In accordance with regulation 1,SI,2024,"",dCr26WIo
6092,Financial Services Act 2021 (Overseas Funds Regime and Recognition of Parts of Schemes) (Amendment and Modification) Regulations 2024,https://www.legislation.gov.uk/ukdsi/2024/9780348254501,"urn:procedure-editor:ActOfParliament:1383,urn:procedure-editor:ActOfParliament:1282",2024-02-26,,SI,2024,"",YVxXI3Ls
6099,Waste Enforcement (Fixed Penalty Receipts) (Amendment) (England and Wales) Regulations 2023,https://www.legislation.gov.uk/ukdsi/2023/9780348254716,urn:procedure-editor:ActOfParliament:1272,2024-04-01,,SI,2023,"",8hGJNe5z
6100,Gender Recognition (Approved Countries and Territories and Saving Provision) Order 2023,https://www.legislation.gov.uk/ukdsi/2023/9780348254648,urn:procedure-editor:ActOfParliament:1347,,in accordance with article 1,SI,2023,"",ZUg8pbz0
6101,National Crime Agency (Directed Tasking) Order 2023,https://www.legislation.gov.uk/ukdsi/2023/9780348254778,urn:procedure-editor:ActOfParliament:1316,,in accordance with article 1,SI,2023,"",EWusa3Qc
6106,Northumberland (Electoral Changes) Order 2024,https://www.legislation.gov.uk/ukdsi/2024/9780348254792,urn:procedure-editor:ActOfParliament:949,,,SI,2024,"",FdikdzVD
6107,Shropshire (Electoral Changes) Order 2024,https://www.legislation.gov.uk/ukdsi/2024/9780348254709,urn:procedure-editor:ActOfParliament:949,,,SI,2024,"",DmQ2N6Zg
6108,Worcester (Electoral Changes) Order 2024,https://www.legislation.gov.uk/ukdsi/2024/9780348254723,urn:procedure-editor:ActOfParliament:949,,,SI,2024,"",emt952oW
6119,Local Government Finance Act 1988 (Prescription of Non-Domestic Rating Multipliers) (England) Regulations 2023,https://www.legislation.gov.uk/ukdsi/2023/9780348255089,urn:procedure-editor:ActOfParliament:397,,In accordance with paragraph 1(3),SI,2023,"",mz7dcPdu
6120,Post Office Network Subsidy Scheme (Amendment) Order 2024,https://www.legislation.gov.uk/ukdsi/2024/9780348255010,urn:procedure-editor:ActOfParliament:469,,,SI,2024,"",em9gXzjY
6122,Representation of the People (Postal and Proxy Voting etc.) (Amendment) Regulations 2024,https://www.legislation.gov.uk/ukdsi/2024/9780348254938,"urn:procedure-editor:ActOfParliament:1718,urn:procedure-editor:ActOfParliament:596,urn:procedure-editor:ActOfParliament:1209,urn:procedure-editor:ActOfParliament:949,urn:procedure-editor:ActOfParliament:1047,urn:procedure-editor:ActOfParliament:928",,,SI,2024,"",yzFOFrjU
6123,Carer’s Leave Regulations 2024,https://www.legislation.gov.uk/ukdsi/2024/9780348254808,urn:procedure-editor:ActOfParliament:1337,2024-04-06,,SI,2024,"",VA6K8OEj
6124,Combined Authorities (Mayors) Filling of Vacancies Order 2017 (Amendment) Regulations 2024,https://www.legislation.gov.uk/ukdsi/2024/9780348255058,urn:procedure-editor:ActOfParliament:18399,,,SI,2024,"",yAovrJUP
6125,Combined Authorities (Mayoral Elections) Order 2017 (Amendment) Regulations 2024,https://www.legislation.gov.uk/ukdsi/2024/9780348255041,"urn:procedure-editor:ActOfParliament:18399,urn:procedure-editor:ActOfParliament:949,urn:procedure-editor:ActOfParliament:6940",,In accordance with Article 1(2) and (3),SI,2024,"",1SPVzrwx
6127,"Maternity Leave, Adoption Leave and Shared Parental Leave (Amendment) Regulations 2024",https://www.legislation.gov.uk/ukdsi/2024/9780348254846,urn:procedure-editor:ActOfParliament:1337,,In accordance with regulation 1(2) and (3).,SI,2024,"",0Xbgwbkj
6128,Sea Fisheries (International Commission for the Conservation of Atlantic Tunas) (Amendment) Regulations 2024,https://www.legislation.gov.uk/ukdsi/2024/9780348255102,urn:procedure-editor:ActOfParliament:1345,2024-04-01,,SI,2024,"",wj4nPY32
6129,North Tyneside (Electoral Changes) Order 2024,https://www.legislation.gov.uk/ukdsi/2024/9780348255034,urn:procedure-editor:ActOfParliament:949,,,SI,2024,"",rjOM8UCr
6130,Tandridge (Electoral Changes) Order 2024,https://www.legislation.gov.uk/ukdsi/2024/9780348255072,urn:procedure-editor:ActOfParliament:949,,,SI,2024,"",umBwLL2D
6132,Anaesthesia Associates and Physician Associates Order 2024,https://www.legislation.gov.uk/ukdsi/2024/9780348255195,urn:procedure-editor:ActOfParliament:1270,,in accordance with article 1,SI,2024,"",ZEQJNbuf
6137,Animal Welfare (Primate Licences) (England) Regulations 2023,https://www.legislation.gov.uk/ukdsi/2023/9780348255423,urn:procedure-editor:ActOfParliament:1328,,,SI,2023,"",v4lhBV14
6138,Occupational Pension Schemes (Collective Money Purchase Schemes) (Amendment) Regulations 2023,https://www.legislation.gov.uk/ukdsi/2023/9780348255232,urn:procedure-editor:ActOfParliament:22,,,SI,2023,"",8dPsaQQr
6141,Pneumoconiosis etc. (Workers' Compensation) (Specified Diseases and Prescribed Occupations) (Amendment) Regulations 2024,https://www.legislation.gov.uk/ukdsi/2024/9780348255218,urn:procedure-editor:ActOfParliament:1944,,,SI,2024,"",VIJjuinw
6151,Principal Office Address (Rectification of Register) Regulations 2024,https://www.legislation.gov.uk/ukdsi/2024/9780348255676,urn:procedure-editor:ActOfParliament:1183,,In accordance with regulation 1(2) ,SI,2024,"",mudSCnNA
6152,Registered Office Address (Rectification of Register) Regulations 2024,https://www.legislation.gov.uk/ukdsi/2024/9780348255645,urn:procedure-editor:ActOfParliament:1183,,In accordance with regulation 1(2),SI,2024,"",AmoT22z3
6153,Service Address (Rectification of Register) Regulations 2024,https://www.legislation.gov.uk/ukdsi/2024/9780348255669,urn:procedure-editor:ActOfParliament:1183,,In accordance with regulation 1(2),SI,2024,"",V8s663lL
6154,Financial Services and Markets Act 2000 (Regulated Activities) (Amendment) Order 2024,https://www.legislation.gov.uk/ukdsi/2024/9780348255584,urn:procedure-editor:ActOfParliament:1282,2024-03-11,,SI,2024,"",D2aOrMCd
6155,East Midlands Combined County Authority Regulations 2024,https://www.legislation.gov.uk/ukdsi/2024/9780348255614,urn:procedure-editor:ActOfParliament:18399,,In accordance with regulation 1(2) and (3),SI,2024,"",0gDalreu
6156,European Organization for Astronomical Research in the Southern Hemisphere and the European Space Agency (Immunities and Privileges) (Amendment) Order 2023,https://www.legislation.gov.uk/ukdsi/2023/9780348255508,urn:procedure-editor:ActOfParliament:2731,,,SI,2023,"",w3ppCCvD
6157,Limited Liability Partnerships (Application of Company Law) Regulations 2024,https://www.legislation.gov.uk/ukdsi/2024/9780348255638,urn:procedure-editor:ActOfParliament:393,,In accordance with regulation 1(2),SI,2024,"",JUd8LcCr
6161,Nuclear Decommissioning Authority (Pension Scheme Amendment) Regulations 2024,https://www.legislation.gov.uk/ukdsi/2024/9780348255805,urn:procedure-editor:ActOfParliament:18398,,In accordance with regulation 1(1),SI,2024,"",hnbUu0Ci
6164,Dudley (Electoral Changes) Order 2024,https://www.legislation.gov.uk/ukdsi/2024/9780348255706,urn:procedure-editor:ActOfParliament:949,,In accordance with article 1(2) and (3),SI,2024,"",OThZOHAR
6165,North Northamptonshire (Electoral Changes) Order 2024,https://www.legislation.gov.uk/ukdsi/2024/9780348255690,urn:procedure-editor:ActOfParliament:949,,In accordance with article 1(2) and (3),SI,2024,"",ocnDp4tn
6174,"Economic Crime and Corporate Transparency Act 2023 (Consequential, Supplementary and Incidental Provisions) Regulations 2024",https://www.legislation.gov.uk/ukdsi/2024/9780348256093,urn:procedure-editor:ActOfParliament:18395,,In accordance with regulation 1(2),SI,2024,"",wLq1vm6r
6175,Reporting on Payment Practices and Performance (Amendment) Regulations 2024,https://www.legislation.gov.uk/ukdsi/2024/9780348256079,"urn:procedure-editor:ActOfParliament:393,urn:procedure-editor:ActOfParliament:1330",,In accordance with regulation 1(2),SI,2024,"",TFyBrV1B
6176,Waste Enforcement (Fixed Penalty Receipts) (Amendment) (England and Wales) Regulations 2023,https://www.legislation.gov.uk/ukdsi/2023/9780348256062,urn:procedure-editor:ActOfParliament:1272,2024-04-01,,SI,2024,"",mP78VP1g
