id,label,workpackagedaycount,areclocksinworkpackagefrozen,triplestoreid,subjectto,proceduralworkpackagehascalculationstyle,proceduralworkpackagefocus
5328,"Work package for Finance Act 2009, Sections 101 and 102 (Value Added Tax) (Late Payment Interest and Repayment Interest) (Exceptions and Consequential Amendments) Order 2022",,false,cA6SkSfG,4,,urn:procedure-editor:MadeStatutoryInstrumentSubjectToParliamentaryProcedureWork:5328
5331,Work package for Local Government Finance Act 1988 (Non-Domestic Rating Multipliers) (England) Order 2022,,false,aPol3mp8,1,,urn:procedure-editor:MadeStatutoryInstrumentSubjectToParliamentaryProcedureWork:5331
5332,Work package for Charities Act 2006 (Principal Regulators of Exempt Charities) (Amendment) Regulations 2022,,false,vW7o7rtf,4,,urn:procedure-editor:MadeStatutoryInstrumentSubjectToParliamentaryProcedureWork:5332
5333,Work package for Prevention and Reduction of Serious Violence (Strategies etc.) Regulations 2022,,false,pi2TWH4d,4,,urn:procedure-editor:MadeStatutoryInstrumentSubjectToParliamentaryProcedureWork:5333
5334,Work package for Customs (Miscellaneous Amendments) (No. 2) Regulations 2022,,false,46AXW8JD,4,,urn:procedure-editor:MadeStatutoryInstrumentSubjectToParliamentaryProcedureWork:5334
5336,Work package for Government Resources and Accounts Act 2000 (Estimates and Accounts) (Amendment) Order 2022,,false,sRkSzM1l,4,,urn:procedure-editor:MadeStatutoryInstrumentSubjectToParliamentaryProcedureWork:5336
5337,"Work package for Finance Act 2022, Schedule 10 (Public Interest Business Protection Tax) (Substitution of Date) Regulations 2022",,false,GVD0MbvK,4,,urn:procedure-editor:MadeStatutoryInstrumentSubjectToParliamentaryProcedureWork:5337
5338,Work package for Eligibility and Registration of General Practitioners and Specialist Medical Practitioners (Amendment) Order of Council 2022,,false,of5fT4i1,4,,urn:procedure-editor:MadeStatutoryInstrumentSubjectToParliamentaryProcedureWork:5338
5346,Work package for Russia (Sanctions) (EU Exit) (Amendment) (No. 17) Regulations 2022,,false,k8zVGh88,1,,urn:procedure-editor:MadeStatutoryInstrumentSubjectToParliamentaryProcedureWork:5346
5347,Work package for Aviation Security (Amendment) (No. 2) Regulations 2022,,false,4yY2o2EM,4,,urn:procedure-editor:MadeStatutoryInstrumentSubjectToParliamentaryProcedureWork:5347
5348,Work package for Education (Student Loans) (Repayment) (Amendment) (No. 4) Regulations 2022,,false,P2Yqfryx,4,,urn:procedure-editor:MadeStatutoryInstrumentSubjectToParliamentaryProcedureWork:5348
5349,Work package for Whole of Government Accounts (Designation of Bodies) (No. 2) Order 2022,,false,loiWlNIH,4,,urn:procedure-editor:MadeStatutoryInstrumentSubjectToParliamentaryProcedureWork:5349
5350,Work package for Short-term Holding Facility (Amendment) Rules 2022,,false,X87P8y7Y,4,,urn:procedure-editor:MadeStatutoryInstrumentSubjectToParliamentaryProcedureWork:5350
5355,Work package for Local Authorities (Capital Finance and Accounting) (England) (Amendment) (No. 2) Regulations 2022,,false,YdmPo4xj,4,,urn:procedure-editor:MadeStatutoryInstrumentSubjectToParliamentaryProcedureWork:5355
5356,Work package for Apprenticeships (Miscellaneous Provisions) (England) (Amendment) (No. 3) Regulations 2022,,false,RGLOCi0L,4,,urn:procedure-editor:MadeStatutoryInstrumentSubjectToParliamentaryProcedureWork:5356
5357,Work package for Plant Health and Trade in Animals and Related Products (Amendment) Regulations 2022,,false,Rzv1cpGi,1,,urn:procedure-editor:MadeStatutoryInstrumentSubjectToParliamentaryProcedureWork:5357
5365,Work package for Health and Safety and Nuclear (Fees) Regulations 2022,,false,hNLDPwIw,1,,urn:procedure-editor:MadeStatutoryInstrumentSubjectToParliamentaryProcedureWork:5365
5366,Work package for Official Controls (Extension of Transitional Periods) (Amendment) (England) Regulations 2022,,false,mqqNDpxp,4,,urn:procedure-editor:MadeStatutoryInstrumentSubjectToParliamentaryProcedureWork:5366
5367,Work package for Communications Act 2003 (Restrictions on the Advertising of Less Healthy Food) (Effective Date) (Amendment) (No. 2) Regulations 2022,,false,Yd0w9J86,4,,urn:procedure-editor:MadeStatutoryInstrumentSubjectToParliamentaryProcedureWork:5367
5368,Work package for Allocation of Housing and Homelessness (Eligibility) (England) and Persons Subject to Immigration Control (Housing Authority Accommodation and Homelessness) (Amendment) (No. 4) Regulations 2022,,false,l1yNTTqm,4,,urn:procedure-editor:MadeStatutoryInstrumentSubjectToParliamentaryProcedureWork:5368
5369,Work package for Civil Legal Aid (Immigration Interviews (Exceptions) and Remuneration) (Amendment) Regulations 2022,,false,aDYDibPZ,4,,urn:procedure-editor:MadeStatutoryInstrumentSubjectToParliamentaryProcedureWork:5369
5370,Work package for Criminal Legal Aid (General) (Amendment) Regulations 2022,,false,eWVfcEnK,4,,urn:procedure-editor:MadeStatutoryInstrumentSubjectToParliamentaryProcedureWork:5370
5371,Work package for Legal Aid (Financial Resources and Contribution Orders) (Amendment) Regulations 2022,,false,86Ezy3sO,4,,urn:procedure-editor:MadeStatutoryInstrumentSubjectToParliamentaryProcedureWork:5371
5372,Work package for Register of Overseas Entities (Verification and Provision of Information) (Amendment) Regulations 2022,,false,4OFIjTvq,4,,urn:procedure-editor:MadeStatutoryInstrumentSubjectToParliamentaryProcedureWork:5372
5373,"Work package for Architects (Fees, Electronic Communications and Miscellaneous Amendments) Regulations 2022",,false,ATLOnvvJ,4,,urn:procedure-editor:MadeStatutoryInstrumentSubjectToParliamentaryProcedureWork:5373
5374,Work package for Education (Student Loans) (Repayment) (Amendment) (No. 5) Regulations 2022,,false,i95uWpTQ,4,,urn:procedure-editor:MadeStatutoryInstrumentSubjectToParliamentaryProcedureWork:5374
5376,"Work package for Voter Identification (Principal Area, Parish and Greater London Authority Elections) (Amendment) Rules 2022",,false,P0bFYtTr,4,,urn:procedure-editor:MadeStatutoryInstrumentSubjectToParliamentaryProcedureWork:5376
5378,"Work package for Health Protection (Coronavirus, International Travel from China) (England) Regulations 2023",,false,cIMYR05O,4,,urn:procedure-editor:MadeStatutoryInstrumentSubjectToParliamentaryProcedureWork:5378
5379,"Work package for Health Protection (Coronavirus, International Travel from China) (England) (Amendment) Regulations 2023",,false,oG2dKJS8,4,,urn:procedure-editor:MadeStatutoryInstrumentSubjectToParliamentaryProcedureWork:5379
5380,Work package for Rent Officers (Housing Benefit and Universal Credit Functions) (Modification) Order 2023,,false,jREfSO3B,4,,urn:procedure-editor:MadeStatutoryInstrumentSubjectToParliamentaryProcedureWork:5380
5381,Work package for Universal Credit (Administrative Earnings Threshold) (Amendment) Regulations 2023,,false,RBJGssfU,4,,urn:procedure-editor:MadeStatutoryInstrumentSubjectToParliamentaryProcedureWork:5381
5384,Work package for Energy Bill Relief Scheme (Non-Standard Cases) Regulations 2023,,false,yw480Ien,1,,urn:procedure-editor:MadeStatutoryInstrumentSubjectToParliamentaryProcedureWork:5384
5385,Work package for Energy Bills Support Scheme and Alternative Fuel Payment Pass-through Requirement (Northern Ireland) Regulations 2023,,false,prlGyl2q,1,,urn:procedure-editor:MadeStatutoryInstrumentSubjectToParliamentaryProcedureWork:5385
5386,Work package for Immigration (Restrictions on Employment etc.) (Amendment) (EU Exit) Regulations 2023,,false,3qG5EgRl,4,,urn:procedure-editor:MadeStatutoryInstrumentSubjectToParliamentaryProcedureWork:5386
5387,Work package for Immigration and Nationality (Fees) and Passport (Fees) (Amendment) Regulations 2023,,false,ffLw1vEQ,4,,urn:procedure-editor:MadeStatutoryInstrumentSubjectToParliamentaryProcedureWork:5387
5388,Work package for Council Tax and Non-Domestic Rating (Demand Notices) (England) (Amendment) Regulations 2023,,false,wStSyRy4,4,,urn:procedure-editor:MadeStatutoryInstrumentSubjectToParliamentaryProcedureWork:5388
5389,Work package for M42 Motorway (Junction 3) (50 Miles Per Hour Speed Limit) Regulations 2023,,false,zKOJHGkS,4,,urn:procedure-editor:MadeStatutoryInstrumentSubjectToParliamentaryProcedureWork:5389
5392,Work package for Agricultural Holdings (Units of Production) (England) Order 2023,,false,9nUv5lFk,4,,urn:procedure-editor:MadeStatutoryInstrumentSubjectToParliamentaryProcedureWork:5392
5396,Work package for Official Controls (Northern Ireland) Regulations 2023,,false,Gco2E4ck,4,,urn:procedure-editor:MadeStatutoryInstrumentSubjectToParliamentaryProcedureWork:5396
5397,Work package for Food Supplements and Food for Specific Groups (Miscellaneous Amendments) Regulations 2023,,false,VUyQ1nls,4,,urn:procedure-editor:MadeStatutoryInstrumentSubjectToParliamentaryProcedureWork:5397
5398,Work package for Value Added Tax (Refund of Tax) Order 2023,,false,dyRsvtGJ,4,,urn:procedure-editor:MadeStatutoryInstrumentSubjectToParliamentaryProcedureWork:5398
5399,Work package for Council Tax Reduction Schemes (Prescribed Requirements) (England) (Amendment) Regulations 2023,,false,rSldGTzJ,4,,urn:procedure-editor:MadeStatutoryInstrumentSubjectToParliamentaryProcedureWork:5399
5400,Work package for Public Lending Right Scheme 1982 (Commencement of Variation) Order 2023,,false,N8Uo53Y6,4,,urn:procedure-editor:MadeStatutoryInstrumentSubjectToParliamentaryProcedureWork:5400
5401,Work package for Carriers? Liability (Amendment) Regulations 2023,,false,l6iLPoOn,4,,urn:procedure-editor:MadeStatutoryInstrumentSubjectToParliamentaryProcedureWork:5401
5402,Work package for Carriers? Liability (Clandestine Entrants) (Level of Penalty: Code of Practice) Order 2023,,false,WjO21FEv,4,,urn:procedure-editor:MadeStatutoryInstrumentSubjectToParliamentaryProcedureWork:5402
5408,Work package for Gender Recognition Reform (Scotland) Bill (Prohibition on Submission for Royal Assent) Order 2023,,false,dr7rHO9B,4,,urn:procedure-editor:MadeStatutoryInstrumentSubjectToParliamentaryProcedureWork:5408
5409,Work package for International Tax Enforcement (Disclosable Arrangements) Regulations 2023,,false,fMzFNZoE,4,,urn:procedure-editor:MadeStatutoryInstrumentSubjectToParliamentaryProcedureWork:5409
5410,Work package for Energy Act 2004 (Assistance for Areas with High Distribution Costs) (Amendment) Order 2023,,false,BUJjAdVm,4,,urn:procedure-editor:MadeStatutoryInstrumentSubjectToParliamentaryProcedureWork:5410
5412,Work package for Merchant Shipping (Watercraft) Order 2023,,false,7H66Qy89,4,,urn:procedure-editor:MadeStatutoryInstrumentSubjectToParliamentaryProcedureWork:5412
5414,Work package for Civil Legal Aid (Financial Resources and Payment for Services) (Amendment) Regulations 2023,,false,TCIrmW7z,4,,urn:procedure-editor:MadeStatutoryInstrumentSubjectToParliamentaryProcedureWork:5414
5415,Work package for Criminal Procedure (Amendment) Rules 2023,,false,EOH9lQgk,4,,urn:procedure-editor:MadeStatutoryInstrumentSubjectToParliamentaryProcedureWork:5415
5418,Work package for School and Early Years Finance (England) Regulations 2023,,false,7R84xLYL,4,,urn:procedure-editor:MadeStatutoryInstrumentSubjectToParliamentaryProcedureWork:5418
5419,Work package for Excise Duties and Value Added Tax (Northern Ireland) (Miscellaneous Modifications and Amendments) Regulations 2023,,false,TKYu7PDw,4,,urn:procedure-editor:MadeStatutoryInstrumentSubjectToParliamentaryProcedureWork:5419
5420,Work package for Family Procedure (Amendment) Rules 2023,,false,vU2fS4iM,4,,urn:procedure-editor:MadeStatutoryInstrumentSubjectToParliamentaryProcedureWork:5420
5421,Work package for Control of Explosives Precursors and Poisons Regulations 2023,,false,be6LOVCu,4,,urn:procedure-editor:MadeStatutoryInstrumentSubjectToParliamentaryProcedureWork:5421
5423,Work package for Value Added Tax (Margin Schemes and Removal or Export of Goods: VAT-related Payments) Order 2023,,false,Ka9AkACS,4,,urn:procedure-editor:MadeStatutoryInstrumentSubjectToParliamentaryProcedureWork:5423
5425,"Work package for Education (Student Fees, Awards and Support) (Amendment) Regulations 2023",,false,2blwEodW,4,,urn:procedure-editor:MadeStatutoryInstrumentSubjectToParliamentaryProcedureWork:5425
5426,Work package for National Health Service (Charges to Overseas Visitors) (Amendment) Regulations 2023,,false,ObkM7Vlo,4,,urn:procedure-editor:MadeStatutoryInstrumentSubjectToParliamentaryProcedureWork:5426
5427,Work package for Firearms (Amendment) Rules 2023,,false,50Vnhpce,4,,urn:procedure-editor:MadeStatutoryInstrumentSubjectToParliamentaryProcedureWork:5427
5430,Work package for Marriage and Civil Partnership (Minimum Age) Act 2022 (Consequential Amendments) Regulations 2023,,false,6SnNiFDF,4,,urn:procedure-editor:MadeStatutoryInstrumentSubjectToParliamentaryProcedureWork:5430
5434,Work package for Criminal Legal Aid (Remuneration) (Amendment) Regulations 2023,,false,HcZdvVHb,4,,urn:procedure-editor:MadeStatutoryInstrumentSubjectToParliamentaryProcedureWork:5434
5436,Work package for Civil Procedure (Amendment) Rules 2023,,false,iBDmezvt,4,,urn:procedure-editor:MadeStatutoryInstrumentSubjectToParliamentaryProcedureWork:5436
5437,Work package for Trade in Endangered Species of Wild Fauna and Flora (Council Regulation (EC) No 338/97) (Amendment) Regulations 2023,,false,CbH00Mv1,4,,urn:procedure-editor:MadeStatutoryInstrumentSubjectToParliamentaryProcedureWork:5437
5440,Work package for Public Service Pension Schemes (Rectification of Unlawful Discrimination) (Tax) Regulations 2023,,false,6JRMsUFw,4,,urn:procedure-editor:MadeStatutoryInstrumentSubjectToParliamentaryProcedureWork:5440
5441,Work package for Hartlepool Development Corporation (Establishment) Order 2023,,false,oBBXf6ea,4,,urn:procedure-editor:MadeStatutoryInstrumentSubjectToParliamentaryProcedureWork:5441
5442,Work package for Middlesbrough Development Corporation (Establishment) Order 2023,,false,AkQzPcCg,4,,urn:procedure-editor:MadeStatutoryInstrumentSubjectToParliamentaryProcedureWork:5442
5443,Work package for Pension Protection Fund and Occupational Pension Schemes (Levy Ceiling) (No. 2) Order 2023,,false,9XD65fiJ,4,,urn:procedure-editor:MadeStatutoryInstrumentSubjectToParliamentaryProcedureWork:5443
5444,Work package for Pension Protection Fund and Occupational Pension Schemes (Levy Ceiling) Order 2023,,false,Vlb53fZI,4,,urn:procedure-editor:MadeStatutoryInstrumentSubjectToParliamentaryProcedureWork:5444
5445,"Work package for Market Measures Payment Schemes (Amendments, Revocation and Transitional Provision) (England) Regulations 2023",,false,OKZhCwC7,4,,urn:procedure-editor:MadeStatutoryInstrumentSubjectToParliamentaryProcedureWork:5445
5448,Work package for Building Safety (Leaseholder Protections) (England) (Amendment) Regulations 2023,,false,pfmAa2g6,4,,urn:procedure-editor:MadeStatutoryInstrumentSubjectToParliamentaryProcedureWork:5448
5449,Work package for Education (Student Loans) (Repayment) (Amendment) Regulations 2023,,false,3JyeBCe4,4,,urn:procedure-editor:MadeStatutoryInstrumentSubjectToParliamentaryProcedureWork:5449
5450,Work package for Feed-in Tariffs (Amendment) Order 2023,,false,8IWIik32,4,,urn:procedure-editor:MadeStatutoryInstrumentSubjectToParliamentaryProcedureWork:5450
5451,Work package for Food Supplements and Food for Specific Groups (Miscellaneous Amendments) (No. 2) Regulations 2023,,false,v8QolUUL,4,,urn:procedure-editor:MadeStatutoryInstrumentSubjectToParliamentaryProcedureWork:5451
5452,Work package for Sanctions (Humanitarian Exception) (Amendment) Regulations 2023,,false,T3Jf6slj,4,,urn:procedure-editor:MadeStatutoryInstrumentSubjectToParliamentaryProcedureWork:5452
5455,Work package for Town and Country Planning (Development Management Procedure) (England) (Amendment) Order 2023,,false,JBuSAL1J,4,,urn:procedure-editor:MadeStatutoryInstrumentSubjectToParliamentaryProcedureWork:5455
5456,Work package for Countryside Stewardship (England) (Amendment) Regulations 2023,,false,TldlxA6g,4,,urn:procedure-editor:MadeStatutoryInstrumentSubjectToParliamentaryProcedureWork:5456
5461,Work package for Alternative Fuel Payment Pass-through Requirement (England and Wales and Scotland) Regulations 2023,,false,xAS0rr9X,1,,urn:procedure-editor:MadeStatutoryInstrumentSubjectToParliamentaryProcedureWork:5461
5462,"Work package for National Health Service (Amendments Relating to Pre-Payment Certificates, Hormone Replacement Therapy Treatments and Medicines Shortages) Regulations 2023",,false,KlE8ZZSc,4,,urn:procedure-editor:MadeStatutoryInstrumentSubjectToParliamentaryProcedureWork:5462
5463,Work package for Public Service (Civil Servants and Others) Pensions (Amendment) Regulations 2023,,false,cvW6tzk2,4,,urn:procedure-editor:MadeStatutoryInstrumentSubjectToParliamentaryProcedureWork:5463
5464,Work package for Education (School Day and School Year) (England) (Amendment) Regulations 2023,,false,9uecdCxy,4,,urn:procedure-editor:MadeStatutoryInstrumentSubjectToParliamentaryProcedureWork:5464
5465,Work package for Maritime Enforcement Powers (Specification of the Civil Nuclear Constabulary) Regulations 2023,,false,4dKw6T9j,4,,urn:procedure-editor:MadeStatutoryInstrumentSubjectToParliamentaryProcedureWork:5465
5466,Work package for Non-Domestic Rating (Designated Areas) Regulations 2023,,false,GE3sDP86,4,,urn:procedure-editor:MadeStatutoryInstrumentSubjectToParliamentaryProcedureWork:5466
5467,Work package for Tax Credits and Child Benefit (Miscellaneous Amendments) Regulations 2023,,false,HrhVfWaU,4,,urn:procedure-editor:MadeStatutoryInstrumentSubjectToParliamentaryProcedureWork:5467
5471,Work package for Non-Domestic Alternative Fuel Payment Pass-through Requirement and Amendment Regulations 2023,,false,N4nW6omu,1,,urn:procedure-editor:MadeStatutoryInstrumentSubjectToParliamentaryProcedureWork:5471
5472,Work package for Post Office Horizon Compensation and Infected Blood Interim Compensation Payment Schemes (Tax Exemptions and Relief) Regulations 2023,,false,bL94Hcxa,4,,urn:procedure-editor:MadeStatutoryInstrumentSubjectToParliamentaryProcedureWork:5472
5473,Work package for Regional Rates (Northern Ireland) Regulations 2023,,false,d5TbHTrd,4,,urn:procedure-editor:MadeStatutoryInstrumentSubjectToParliamentaryProcedureWork:5473
5474,Work package for Road Traffic Act 1988 (Police Driving: Prescribed Training) Regulations 2023,,false,NLcVszT1,4,,urn:procedure-editor:MadeStatutoryInstrumentSubjectToParliamentaryProcedureWork:5474
5475,Work package for Social Security (Contributions) (Amendment) Regulations 2023,,false,47dH7L90,4,,urn:procedure-editor:MadeStatutoryInstrumentSubjectToParliamentaryProcedureWork:5475
5477,Work package for Private Security Industry Act 2001 (Licences) (Amendment) Regulations 2023,,false,oe9oyn7Z,4,,urn:procedure-editor:MadeStatutoryInstrumentSubjectToParliamentaryProcedureWork:5477
5478,Work package for Customs Tariff (Preferential Trade Arrangements and Tariff Quotas) (Australia) (Amendment) Regulations 2023,,false,biKOIUTZ,4,,urn:procedure-editor:MadeStatutoryInstrumentSubjectToParliamentaryProcedureWork:5478
5479,Work package for Customs Tariff (Preferential Trade Arrangements) (New Zealand) (Amendment) Regulations 2023,,false,wEib6NEY,4,,urn:procedure-editor:MadeStatutoryInstrumentSubjectToParliamentaryProcedureWork:5479
5481,Work package for Police Pensions (Contributions and Pensionable Earnings) (Amendment) (England and Wales) Regulations 2023,,false,ePmGYD7S,4,,urn:procedure-editor:MadeStatutoryInstrumentSubjectToParliamentaryProcedureWork:5481
5482,Work package for Trade Remedies (Dumping and Subsidisation) (Amendment) Regulations 2023,,false,BJrQuLAo,4,,urn:procedure-editor:MadeStatutoryInstrumentSubjectToParliamentaryProcedureWork:5482
5483,Work package for Personal Injuries (NHS Charges) (Amounts) (Amendment) Regulations 2023,,false,WdsYIwYQ,4,,urn:procedure-editor:MadeStatutoryInstrumentSubjectToParliamentaryProcedureWork:5483
5484,Work package for National Health Service (Joint Working and Delegation Arrangements) (England) (Amendment) Regulations 2023,,false,iAapTm3W,4,,urn:procedure-editor:MadeStatutoryInstrumentSubjectToParliamentaryProcedureWork:5484
5486,Work package for Approved Country Lists (Animals and Animal Products) (Amendment) Regulations 2023,,false,w19lylBx,4,,urn:procedure-editor:MadeStatutoryInstrumentSubjectToParliamentaryProcedureWork:5486
5487,Work package for Taxes (Interest Rate) (Amendment) Regulations 2023,,false,aiWrbQXk,4,,urn:procedure-editor:MadeStatutoryInstrumentSubjectToParliamentaryProcedureWork:5487
5488,Work package for Income and Corporation Taxes (Electronic Communications) (Amendment) Regulations 2023,,false,NBPi2EIg,4,,urn:procedure-editor:MadeStatutoryInstrumentSubjectToParliamentaryProcedureWork:5488
5490,Work package for Exotic Equine Diseases (Compensation) (England) Order 2023,,false,TeYXldGN,4,,urn:procedure-editor:MadeStatutoryInstrumentSubjectToParliamentaryProcedureWork:5490
5491,Work package for Building Safety Act 2022 (Consequential Amendments and Prescribed Functions) and Architects Act 1997 (Amendment) Regulations 2023,,false,5BzNtnCZ,4,,urn:procedure-editor:MadeStatutoryInstrumentSubjectToParliamentaryProcedureWork:5491
5492,Work package for Armed Forces (Driving Disqualification Orders) Regulations 2023,,false,FmrvdD5z,4,,urn:procedure-editor:MadeStatutoryInstrumentSubjectToParliamentaryProcedureWork:5492
5493,Work package for Oil and Gas Authority (Levy and Fees) Regulation 2023,,false,7Zz7SiD9,4,,urn:procedure-editor:MadeStatutoryInstrumentSubjectToParliamentaryProcedureWork:5493
5494,Work package for Loans for Mortgage Interest (Amendment) Regulations 2023,,false,2aeo97ka,4,,urn:procedure-editor:MadeStatutoryInstrumentSubjectToParliamentaryProcedureWork:5494
5495,Work package for Social Security Benefits (Claims and Payments) (Amendment) Regulations 2023,,false,de53Fryp,4,,urn:procedure-editor:MadeStatutoryInstrumentSubjectToParliamentaryProcedureWork:5495
5498,Work package for Valuation for Rating (Coronavirus) (England) Regulations 2023,,false,cZodluPC,4,,urn:procedure-editor:MadeStatutoryInstrumentSubjectToParliamentaryProcedureWork:5498
5499,Work package for Health and Social Care Act 2008 (Regulated Care Functions) Regulations 2023,,false,s1LmlFaM,4,,urn:procedure-editor:MadeStatutoryInstrumentSubjectToParliamentaryProcedureWork:5499
5500,Work package for Branded Health Service Medicines (Costs) (Amendment) Regulations 2023,,false,uMSlcklt,4,,urn:procedure-editor:MadeStatutoryInstrumentSubjectToParliamentaryProcedureWork:5500
5501,Work package for Rating Lists (Valuation Date) (England) Order 2023,,false,cvqOFgHB,4,,urn:procedure-editor:MadeStatutoryInstrumentSubjectToParliamentaryProcedureWork:5501
5502,Work package for Genetically Modified Food and Feed (Authorisations and Modifications of Authorisations) (England) Regulations 2023,,false,FYQDQk7b,4,,urn:procedure-editor:MadeStatutoryInstrumentSubjectToParliamentaryProcedureWork:5502
5504,Work package for National Health Service (Optical Charges and Payments) (Amendment) Regulations 2023,,false,bv9iUa8z,4,,urn:procedure-editor:MadeStatutoryInstrumentSubjectToParliamentaryProcedureWork:5504
5508,"Work package for Police, Crime, Sentencing and Courts Act 2022 (Consequential Provision) (England and Wales) Regulations 2023",,false,drGSqQv3,4,,urn:procedure-editor:MadeStatutoryInstrumentSubjectToParliamentaryProcedureWork:5508
5509,Work package for Health and Safety and Nuclear (Fees) (Amendment) Regulations 2023,,false,3JNiHRoA,4,,urn:procedure-editor:MadeStatutoryInstrumentSubjectToParliamentaryProcedureWork:5509
5510,Work package for Local Authorities (Capital Finance and Accounting) (England) (Amendment) Regulations 2023,,false,J6hnjywE,4,,urn:procedure-editor:MadeStatutoryInstrumentSubjectToParliamentaryProcedureWork:5510
5511,Work package for Child Trust Funds (Amendment) Regulations 2023,,false,0Kw9uq87,4,,urn:procedure-editor:MadeStatutoryInstrumentSubjectToParliamentaryProcedureWork:5511
5512,Work package for Individual Savings Account (Amendment) Regulations 2023,,false,QgNwmSc8,4,,urn:procedure-editor:MadeStatutoryInstrumentSubjectToParliamentaryProcedureWork:5512
5513,Work package for Merchant Shipping (Cargo and Passenger Ship Construction and Miscellaneous Amendments) Regulations 2023,,false,85KIHZJC,4,,urn:procedure-editor:MadeStatutoryInstrumentSubjectToParliamentaryProcedureWork:5513
5514,Work package for Occupational Pension Schemes (Pension Protection Fund (Compensation) and Fraud Compensation Payments) (Amendment) Regulations 2023,,false,EPPjlEZl,4,,urn:procedure-editor:MadeStatutoryInstrumentSubjectToParliamentaryProcedureWork:5514
5515,Work package for Sea Fisheries (Amendment) Regulations 2023,,false,ykr9C2W9,4,,urn:procedure-editor:MadeStatutoryInstrumentSubjectToParliamentaryProcedureWork:5515
5516,Work package for Care and Support (Charging and Assessment of Resources) (Amendment) Regulations 2023,,false,AOF18FIf,4,,urn:procedure-editor:MadeStatutoryInstrumentSubjectToParliamentaryProcedureWork:5516
5517,Work package for Guardian?s Allowance Up-rating Regulations 2023,,false,502PI1jP,4,,urn:procedure-editor:MadeStatutoryInstrumentSubjectToParliamentaryProcedureWork:5517
5518,Work package for Social Security Revaluation of Earnings Factors Order 2023,,false,pfWLtR7U,4,,urn:procedure-editor:MadeStatutoryInstrumentSubjectToParliamentaryProcedureWork:5518
5519,Work package for Welfare of Animals (Transport) (Miscellaneous Amendments) (England and Scotland) Regulations 2023,,false,jfwJ2qfv,4,,urn:procedure-editor:MadeStatutoryInstrumentSubjectToParliamentaryProcedureWork:5519
5520,"Work package for Childcare and Inspection of Education, Children?s Services and Skills (Fees) (Amendments) Regulations 2023",,false,kmL1X65x,4,,urn:procedure-editor:MadeStatutoryInstrumentSubjectToParliamentaryProcedureWork:5520
5521,Work package for Sentencing Act 2020 (Magistrates? Court Sentencing Powers) (Amendment) Regulations 2023,,false,hQkIXhDQ,4,,urn:procedure-editor:MadeStatutoryInstrumentSubjectToParliamentaryProcedureWork:5521
