id,label,workpackagedaycount,areclocksinworkpackagefrozen,triplestoreid,subjectto,proceduralworkpackagehascalculationstyle,proceduralworkpackagefocus
2259,Work package for Housing and Planning Act 2016 (Database of Rogue Landlords and Property Agents) Regulations 2018,,false,hDJjBUGx,4,,urn:procedure-editor:MadeStatutoryInstrumentSubjectToParliamentaryProcedureWork:2259
2260,Work package for Capital Allowances (Energy-saving Plant and Machinery) Order 2018,,false,FjPHNRy9,4,,urn:procedure-editor:MadeStatutoryInstrumentSubjectToParliamentaryProcedureWork:2260
2261,Work package for Income Tax (Pay As You Earn) (Amendment) Regulations 2018,,false,M9W6u6vj,4,,urn:procedure-editor:MadeStatutoryInstrumentSubjectToParliamentaryProcedureWork:2261
2262,Work package for Local Land Charges Rules 2018,,false,KaEEgbBE,4,,urn:procedure-editor:MadeStatutoryInstrumentSubjectToParliamentaryProcedureWork:2262
2263,Work package for Borough of Weymouth and Portland (Change to Year of Election) Order 2018,,false,BNnhXHRf,4,,urn:procedure-editor:MadeStatutoryInstrumentSubjectToParliamentaryProcedureWork:2263
2264,Work package for Motorways Traffic (England and Wales) (Amendment) Regulations 2018,,false,AE4JgXtT,4,,urn:procedure-editor:MadeStatutoryInstrumentSubjectToParliamentaryProcedureWork:2264
2265,Work package for Motorways Traffic (Scotland) (Amendment) Regulations 2018,,false,HDTjOmNF,4,,urn:procedure-editor:MadeStatutoryInstrumentSubjectToParliamentaryProcedureWork:2265
2266,Work package for Police Injury Benefit (Amendment) (England and Wales) Regulations 2018,,false,5wxDDqSk,4,,urn:procedure-editor:MadeStatutoryInstrumentSubjectToParliamentaryProcedureWork:2266
2267,Work package for M3 Motorway (Junctions 2 to 4a) and the M25 Motorway (Junction 12) (Speed Limits) (Miscellaneous Amendments) Regulations 2018,,false,Qm3A3fni,4,,urn:procedure-editor:MadeStatutoryInstrumentSubjectToParliamentaryProcedureWork:2267
2269,Work package for Education (Student Loans) (Repayment) (Amendment) Regulations 2018,,false,pyknypKF,4,,urn:procedure-editor:MadeStatutoryInstrumentSubjectToParliamentaryProcedureWork:2269
2270,Work package for Marine Works (Environmental Impact Assessment) and Marine Strategy (Amendment) Regulations 2018,,false,UqKmYKh9,4,,urn:procedure-editor:MadeStatutoryInstrumentSubjectToParliamentaryProcedureWork:2270
2271,"Work package for Responsibilities and Standing Rules, and Care and Support (Miscellaneous Amendments) Regulations 2018",,false,9UHKofQm,4,,urn:procedure-editor:MadeStatutoryInstrumentSubjectToParliamentaryProcedureWork:2271
2272,Work package for Plant Health (Export Certification) (England) (Amendment) Order 2018,,false,Oxu5ZWTP,4,,urn:procedure-editor:MadeStatutoryInstrumentSubjectToParliamentaryProcedureWork:2272
2273,Work package for Plant Health etc. (Fees) (England) Regulations 2018,,false,rPE6db1p,4,,urn:procedure-editor:MadeStatutoryInstrumentSubjectToParliamentaryProcedureWork:2273
2274,Work package for Social Security Revaluation of Earnings Factors Order 2018,,false,iZGxhQ29,4,,urn:procedure-editor:MadeStatutoryInstrumentSubjectToParliamentaryProcedureWork:2274
2275,Work package for Fulfilment Businesses (Approval Scheme) Regulations 2018,,false,un8fHvqu,4,,urn:procedure-editor:MadeStatutoryInstrumentSubjectToParliamentaryProcedureWork:2275
2276,Work package for Wales Act 2017 (Welsh Harbours) (Transitional Provisions and Savings) Regulations 2018,,false,o5mA1uKi,4,,urn:procedure-editor:MadeStatutoryInstrumentSubjectToParliamentaryProcedureWork:2276
2277,Work package for Universal Credit Housing Costs (Executive Determinations) (Amendment) Regulations (Northern Ireland) 2018,,false,DlsR4vWS,4,,urn:procedure-editor:MadeStatutoryInstrumentSubjectToParliamentaryProcedureWork:2277
2278,Work package for Section 318C Income Tax (Earnings and Pensions) Act 2003 (Amendment) Regulations 2018,,false,b4VdRLDT,4,,urn:procedure-editor:MadeStatutoryInstrumentSubjectToParliamentaryProcedureWork:2278
2279,Work package for Loans for Mortgage Interest and Social Fund Maternity Grant (Amendment) Regulations 2018,,false,VkWbwPk0,4,,urn:procedure-editor:MadeStatutoryInstrumentSubjectToParliamentaryProcedureWork:2279
2280,Work package for Greenhouse Gas Emissions Trading Scheme (Amendment) Regulations 2018,,false,Y68Nv81B,4,,urn:procedure-editor:MadeStatutoryInstrumentSubjectToParliamentaryProcedureWork:2280
2281,Work package for Loans for Mortgage Interest and Social Fund Maternity Grant (Amendment) Regulations (Northern Ireland) 2018,,false,vdaCnmut,4,,urn:procedure-editor:MadeStatutoryInstrumentSubjectToParliamentaryProcedureWork:2281
2282,Work package for Fulfilment Businesses Regulations 2018,,false,xL3OsuH2,4,,urn:procedure-editor:MadeStatutoryInstrumentSubjectToParliamentaryProcedureWork:2282
2283,Work package for Government Resources and Accounts Act 2000 (Estimates and Accounts) Order 2018,,false,ibjPKPeG,4,,urn:procedure-editor:MadeStatutoryInstrumentSubjectToParliamentaryProcedureWork:2283
2284,Work package for Qualifying Care Relief (Specified Social Care Schemes) (Amendment) Order 2018,,false,0505WiYn,4,,urn:procedure-editor:MadeStatutoryInstrumentSubjectToParliamentaryProcedureWork:2284
2285,Work package for Armed Forces and Reserve Forces (Compensation Scheme) (Amendment) Order 2018,,false,sJ5xgbwr,4,,urn:procedure-editor:MadeStatutoryInstrumentSubjectToParliamentaryProcedureWork:2285
2286,Work package for Personal Injuries (Civilians) Scheme (Amendment) Order 2018,,false,HCezOJaT,4,,urn:procedure-editor:MadeStatutoryInstrumentSubjectToParliamentaryProcedureWork:2286
2287,Work package for Plant Health (England) (Amendment) (No. 2) Order 2018,,false,0MvmZAX5,4,,urn:procedure-editor:MadeStatutoryInstrumentSubjectToParliamentaryProcedureWork:2287
2288,Work package for Social Security (Invalid Care Allowance) (Amendment) Regulations 2018,,false,0mwAp0Hs,4,,urn:procedure-editor:MadeStatutoryInstrumentSubjectToParliamentaryProcedureWork:2288
2289,Work package for Social Security Benefits Up-rating Regulations 2018,,false,vbTLQeCc,4,,urn:procedure-editor:MadeStatutoryInstrumentSubjectToParliamentaryProcedureWork:2289
2290,Work package for Communications (Television Licensing) (Amendment) (No. 2) Regulations 2018,,false,Hkkk98q4,4,,urn:procedure-editor:MadeStatutoryInstrumentSubjectToParliamentaryProcedureWork:2290
2291,Work package for Branded Health Service Medicines (Costs) Regulations 2018,,false,oU0wupSE,4,,urn:procedure-editor:MadeStatutoryInstrumentSubjectToParliamentaryProcedureWork:2291
2292,Work package for National Health Service (Dental Charges) (Amendment) Regulations 2018,,false,0YvT9XBv,4,,urn:procedure-editor:MadeStatutoryInstrumentSubjectToParliamentaryProcedureWork:2292
2293,Work package for Pensions Increase (Review) Order 2018,,false,1QYYsnT2,4,,urn:procedure-editor:MadeStatutoryInstrumentSubjectToParliamentaryProcedureWork:2293
2294,Work package for Public Service Pensions Revaluation Order 2018,,false,lt7RPKuH,4,,urn:procedure-editor:MadeStatutoryInstrumentSubjectToParliamentaryProcedureWork:2294
2295,"Work package for Natural Mineral Water, Spring Water and Bottled Drinking Water (England) (Amendment) Regulations 2018",,false,2bmr5pJk,4,,urn:procedure-editor:MadeStatutoryInstrumentSubjectToParliamentaryProcedureWork:2295
2296,Work package for Proceeds of Crime Act 2002 (References to Financial Investigators) (Amendment) (England and Wales) Order 2018,,false,PWKbm0VR,4,,urn:procedure-editor:MadeStatutoryInstrumentSubjectToParliamentaryProcedureWork:2296
2297,Work package for Town and Country Planning (General Permitted Development) (England) (Amendment) Order 2018,,false,zrgyh6Nd,4,,urn:procedure-editor:MadeStatutoryInstrumentSubjectToParliamentaryProcedureWork:2297
2301,Work package for Child Trust Funds (Amendment) Regulations 2018,,false,mknnFLoA,4,,urn:procedure-editor:MadeStatutoryInstrumentSubjectToParliamentaryProcedureWork:2301
2302,Work package for Individual Savings Account (Amendment) Regulations 2018,,false,zPNmOMIY,4,,urn:procedure-editor:MadeStatutoryInstrumentSubjectToParliamentaryProcedureWork:2302
2303,Work package for Investigatory Powers (Disclosure of Statistical Information) Regulations 2018,,false,HyPxloAo,4,,urn:procedure-editor:MadeStatutoryInstrumentSubjectToParliamentaryProcedureWork:2303
2304,Work package for Social Security (Contributions) (Re-rating) Consequential Amendment Regulations 2018,,false,LIElRBvV,4,,urn:procedure-editor:MadeStatutoryInstrumentSubjectToParliamentaryProcedureWork:2304
2305,Work package for Tax Credits and Childcare (Miscellaneous Amendments) Regulations 2018,,false,IE2fwwaH,4,,urn:procedure-editor:MadeStatutoryInstrumentSubjectToParliamentaryProcedureWork:2305
2308,Work package for Animals (Scientific Procedures) Act 1986 (Fees) Order 2018,,false,ZrwtOltg,4,,urn:procedure-editor:MadeStatutoryInstrumentSubjectToParliamentaryProcedureWork:2308
2309,Work package for Energy Performance of Buildings (England and Wales) (Amendment) Regulations 2018,,false,4Jck6qLO,4,,urn:procedure-editor:MadeStatutoryInstrumentSubjectToParliamentaryProcedureWork:2309
2310,Work package for Civil Aviation (Investigation of Air Accidents and Incidents) Regulations 2018,,false,6gpQbrve,4,,urn:procedure-editor:MadeStatutoryInstrumentSubjectToParliamentaryProcedureWork:2310
2311,Work package for Pension Schemes (Application of UK Provisions to Relevant Non-UK Schemes) (Amendment) Regulations 2018,,false,1F4n6T8i,4,,urn:procedure-editor:MadeStatutoryInstrumentSubjectToParliamentaryProcedureWork:2311
2312,Work package for Relevant Overseas Schemes (Transfer of Sums and Assets) Regulations 2018,,false,zkaxt1gr,4,,urn:procedure-editor:MadeStatutoryInstrumentSubjectToParliamentaryProcedureWork:2312
2313,Work package for Guardian?s Allowance Up-rating Regulations 2018,,false,f5te6MUA,4,,urn:procedure-editor:MadeStatutoryInstrumentSubjectToParliamentaryProcedureWork:2313
2314,Work package for Railways (Penalty Fares) Regulations 2018,,false,M1teSEEB,4,,urn:procedure-editor:MadeStatutoryInstrumentSubjectToParliamentaryProcedureWork:2314
2315,Work package for Immigration and Nationality (Fees) Regulations 2018,,false,gV9MYlON,4,,urn:procedure-editor:MadeStatutoryInstrumentSubjectToParliamentaryProcedureWork:2315
2324,Work package for Health Service Medicines (Price Control Penalties and Price Control Appeals Amendment) Regulations 2018,,false,Ch2SHKf9,4,,urn:procedure-editor:MadeStatutoryInstrumentSubjectToParliamentaryProcedureWork:2324
2326,Work package for Early Years Foundation Stage (Exemption from Learning and Development Requirements) and Local Authority (Duty to Secure Early Years Provision Free of Charge) (Amendment) Regulations 2018,,false,9bq5JUwG,4,,urn:procedure-editor:MadeStatutoryInstrumentSubjectToParliamentaryProcedureWork:2326
2327,Work package for Personal Protective Equipment (Enforcement) Regulations 2018,,false,sMaooqjd,4,,urn:procedure-editor:MadeStatutoryInstrumentSubjectToParliamentaryProcedureWork:2327
2328,Work package for Gas Appliances (Enforcement) and Miscellaneous Amendments Regulations 2018,,false,QIoArO8d,4,,urn:procedure-editor:MadeStatutoryInstrumentSubjectToParliamentaryProcedureWork:2328
2329,"Work package for Secretaries of State for Health and Social Care and for Housing, Communities and Local Government and Transfer of Functions (Commonhold Land) Order 2018",,false,LUfFyoWF,4,,urn:procedure-editor:MadeStatutoryInstrumentSubjectToParliamentaryProcedureWork:2329
2330,Work package for Aggregates Levy (General) (Amendment) Regulations 2018,,false,x5lrscK1,4,,urn:procedure-editor:MadeStatutoryInstrumentSubjectToParliamentaryProcedureWork:2330
2331,Work package for Landfill Tax (Miscellaneous Provisions) Regulations 2018,,false,Xkr6O5E7,4,,urn:procedure-editor:MadeStatutoryInstrumentSubjectToParliamentaryProcedureWork:2331
2332,Work package for Mandatory Travel Concession (England) (Amendment) Regulations 2018,,false,A5oRUHlj,4,,urn:procedure-editor:MadeStatutoryInstrumentSubjectToParliamentaryProcedureWork:2332
2333,Work package for Nuclear Security (Secretary of State Security Directions) Regulations 2018,,false,eKp1vTVG,4,,urn:procedure-editor:MadeStatutoryInstrumentSubjectToParliamentaryProcedureWork:2333
2334,Work package for Police Super-complaints (Criteria for the Making and Revocation of Designations) Regulations 2018,,false,QA1GIWyF,4,,urn:procedure-editor:MadeStatutoryInstrumentSubjectToParliamentaryProcedureWork:2334
2335,"Work package for Education (Student Support) (Revocation, Amendment and Saving Provision) Regulations 2018",,false,V9vTI7gg,4,,urn:procedure-editor:MadeStatutoryInstrumentSubjectToParliamentaryProcedureWork:2335
2336,Work package for Detention Centre (Amendment) Rules 2018,,false,eidYDff7,4,,urn:procedure-editor:MadeStatutoryInstrumentSubjectToParliamentaryProcedureWork:2336
2337,Work package for Immigration (Guidance on Detention of Vulnerable Persons) Regulations 2018,,false,U7N9tbbr,4,,urn:procedure-editor:MadeStatutoryInstrumentSubjectToParliamentaryProcedureWork:2337
2338,Work package for Short-term Holding Facility Rules 2018,,false,ahvBLLVW,4,,urn:procedure-editor:MadeStatutoryInstrumentSubjectToParliamentaryProcedureWork:2338
2344,Work package for Landfill Tax (Disposals of Material) Order 2018,,false,2LMpvsKK,1,,urn:procedure-editor:MadeStatutoryInstrumentSubjectToParliamentaryProcedureWork:2344
2345,Work package for Education (Student Support) (Amendment) (No. 2) Regulations 2018,,false,RfszCRsf,4,,urn:procedure-editor:MadeStatutoryInstrumentSubjectToParliamentaryProcedureWork:2345
2346,Work package for Electronic Communications (Universal Service) (Broadband) Order 2018,,false,EkM7CFcF,4,,urn:procedure-editor:MadeStatutoryInstrumentSubjectToParliamentaryProcedureWork:2346
2347,Work package for Radioactive Contaminated Land (Enabling Powers and Modification of Enactments) (England) (Amendment) Regulations 2018,,false,N5zMX75h,4,,urn:procedure-editor:MadeStatutoryInstrumentSubjectToParliamentaryProcedureWork:2347
2348,Work package for Family Procedure (Amendment) Rules 2018,,false,QbbPH3IO,4,,urn:procedure-editor:MadeStatutoryInstrumentSubjectToParliamentaryProcedureWork:2348
2349,Work package for Justification of Practices Involving Ionising Radiation (Amendment) Regulations 2018,,false,cuozUle3,4,,urn:procedure-editor:MadeStatutoryInstrumentSubjectToParliamentaryProcedureWork:2349
2350,Work package for HGV Road User Levy (Rate for Prescribed Vehicles) Regulations 2018,,false,EGGo1KWm,4,,urn:procedure-editor:MadeStatutoryInstrumentSubjectToParliamentaryProcedureWork:2350
2351,Work package for Sea Fish (Marketing Standards) (England and Wales and Northern Ireland) Regulations 2018,,false,5nZ6Zn7a,4,,urn:procedure-editor:MadeStatutoryInstrumentSubjectToParliamentaryProcedureWork:2351
2358,Work package for Sexual Offences Act 2003 (Prescribed Police Stations) (England and Wales) Regulations 2018,,false,ACCnfOcb,4,,urn:procedure-editor:MadeStatutoryInstrumentSubjectToParliamentaryProcedureWork:2358
2359,Work package for Non-Domestic Rating (Telecommunications Infrastructure Relief) (England) Regulations 2018,,false,b1I6Sek0,4,,urn:procedure-editor:MadeStatutoryInstrumentSubjectToParliamentaryProcedureWork:2359
2360,"Work package for Police, Fire and Crime Commissioner for Essex (Fire and Rescue Authority) Order 2017",,false,Xrgnc5nK,4,,urn:procedure-editor:MadeStatutoryInstrumentSubjectToParliamentaryProcedureWork:2360
2361,"Work package for Fire and Rescue Authority (Police and Crime Commissioner) (Application of Local Policing Provisions, Inspection, Powers to Trade and Consequential Amendments) Order 2017",,false,5iLEXavT,4,,urn:procedure-editor:MadeStatutoryInstrumentSubjectToParliamentaryProcedureWork:2361
2362,Work package for United Nations and European Union Financial Sanctions (Linking) (Amendment) Regulations 2017,,false,DrUqCVq6,4,,urn:procedure-editor:MadeStatutoryInstrumentSubjectToParliamentaryProcedureWork:2362
2363,Work package for Operation of Public Service Vehicles (Partnership) (Amendment) Regulations 2017,,false,o6p1Bz6N,4,,urn:procedure-editor:MadeStatutoryInstrumentSubjectToParliamentaryProcedureWork:2363
2364,Work package for Goods Vehicles (Licensing of Operators) (Amendment) Regulations 2017,,false,huLBjvwB,4,,urn:procedure-editor:MadeStatutoryInstrumentSubjectToParliamentaryProcedureWork:2364
2365,Work package for Road Vehicles (Authorised Weight) and (Construction and Use) (Amendment) Regulations 2017,,false,QYrucy2H,4,,urn:procedure-editor:MadeStatutoryInstrumentSubjectToParliamentaryProcedureWork:2365
2366,Work package for Lobsters and Crawfish (Prohibition of Fishing and Landing) (Amendment) (England) Order 2017,,false,3WqYg9QN,4,,urn:procedure-editor:MadeStatutoryInstrumentSubjectToParliamentaryProcedureWork:2366
2367,Work package for Civil Procedure (Amendment No. 2) Rules 2017,,false,Wb1Hl1GL,4,,urn:procedure-editor:MadeStatutoryInstrumentSubjectToParliamentaryProcedureWork:2367
2368,Work package for Recognition and Derecognition Ballots (Qualified Persons) (Amendment) Order 2017,,false,y1sH3sCy,4,,urn:procedure-editor:MadeStatutoryInstrumentSubjectToParliamentaryProcedureWork:2368
2369,Work package for Tonnage Tax (Training Requirement) (Amendment etc.) Regulations 2017,,false,sIC1dz7l,4,,urn:procedure-editor:MadeStatutoryInstrumentSubjectToParliamentaryProcedureWork:2369
2370,Work package for Trade Union Ballots and Elections (Independent Scrutineer Qualifications) (Amendment) Order 2017,,false,iCbxLs2g,4,,urn:procedure-editor:MadeStatutoryInstrumentSubjectToParliamentaryProcedureWork:2370
2372,Work package for Magistrates' Courts (Immigration Act 2014) (Freezing Orders) Rules 2018,,false,FUpx9WMi,4,,urn:procedure-editor:MadeStatutoryInstrumentSubjectToParliamentaryProcedureWork:2372
2373,Work package for Care Quality Commission (Reviews and Performance Assessments) Regulations 2018,,false,s57F9g2S,4,,urn:procedure-editor:MadeStatutoryInstrumentSubjectToParliamentaryProcedureWork:2373
2374,Work package for National Health Service (Quality Accounts) (Amendment) (No. 2) Regulations 2018,,false,WnW3MltF,4,,urn:procedure-editor:MadeStatutoryInstrumentSubjectToParliamentaryProcedureWork:2374
2375,Work package for Social Fund Funeral Expenses Amendment Regulations 2018,,false,okQ7IGYS,4,,urn:procedure-editor:MadeStatutoryInstrumentSubjectToParliamentaryProcedureWork:2375
2376,"Work package for Universal Credit (Miscellaneous Amendments, Saving and Transitional Provision) Regulations 2018",,false,CFGQx6VU,4,,urn:procedure-editor:MadeStatutoryInstrumentSubjectToParliamentaryProcedureWork:2376
2385,Work package for Licensing of Houses in Multiple Occupation (Prescribed Description) (England) Order 2018,,false,SdkM7gEo,4,,urn:procedure-editor:MadeStatutoryInstrumentSubjectToParliamentaryProcedureWork:2385
2388,Work package for Heavy Commercial Vehicles in Kent (No. 2) Order 2019,,false,rXViDaBm,1,,urn:procedure-editor:MadeStatutoryInstrumentSubjectToParliamentaryProcedureWork:2388
2389,Work package for Heavy Commercial Vehicles in Kent (No. 3) Order 2019,,false,bfDm0wX4,4,,urn:procedure-editor:MadeStatutoryInstrumentSubjectToParliamentaryProcedureWork:2389
2390,Work package for Weights and Measures Act 1985 (Amendment) and Units of Measurement Regulations 1986 (Amendment) Regulations 2019,,false,GdKcDLyk,4,,urn:procedure-editor:MadeStatutoryInstrumentSubjectToParliamentaryProcedureWork:2390
2391,Work package for Animal Health and Genetically Modified Organisms (Amendment) (EU Exit) Regulations 2019,,false,OIvKCJP3,1,,urn:procedure-editor:MadeStatutoryInstrumentSubjectToParliamentaryProcedureWork:2391
2392,Work package for Trade in Animals and Animal Products (Legislative Functions) and Veterinary Surgeons (Amendment) (EU Exit) Regulations 2019,,false,lAYJPsCO,1,,urn:procedure-editor:MadeStatutoryInstrumentSubjectToParliamentaryProcedureWork:2392
2393,Work package for Air Services (Competition) (Amendment and Revocation) (EU Exit) Regulations 2019,,false,iY1Tzqke,1,,urn:procedure-editor:MadeStatutoryInstrumentSubjectToParliamentaryProcedureWork:2393
2394,Work package for Customs Safety and Security Procedures (EU Exit) (No. 2) Regulations 2019,,false,Q0HR752l,1,,urn:procedure-editor:MadeStatutoryInstrumentSubjectToParliamentaryProcedureWork:2394
2395,Work package for Capital Requirements (Amendment) (EU Exit) Regulations 2019,,false,SXOQ2GUx,1,,urn:procedure-editor:MadeStatutoryInstrumentSubjectToParliamentaryProcedureWork:2395
2396,"Work package for Financial Services (Electronic Money, Payment Services and Miscellaneous Amendments) (EU Exit) Regulations 2019",,false,TB2qApBg,1,,urn:procedure-editor:MadeStatutoryInstrumentSubjectToParliamentaryProcedureWork:2396
2397,Work package for Prospectus (Amendment etc.) (EU Exit) Regulations 2019,,false,9gNZ5uXp,1,,urn:procedure-editor:MadeStatutoryInstrumentSubjectToParliamentaryProcedureWork:2397
2398,Work package for Risk Transformation and Solvency 2 (Amendment) (EU Exit) Regulations 2019,,false,rBdRZZaF,1,,urn:procedure-editor:MadeStatutoryInstrumentSubjectToParliamentaryProcedureWork:2398
2400,"Work package for Animal Health, Invasive Alien Species, Plant Breeders' Rights and Seeds (Amendment etc.) (EU Exit) Regulations 2019",,false,uRgU1OQR,4,,urn:procedure-editor:MadeStatutoryInstrumentSubjectToParliamentaryProcedureWork:2400
2401,Work package for Customs and Excise (Miscellaneous Provisions and Amendments) (EU Exit) Regulations 2019,,false,eIyP2ZAj,4,,urn:procedure-editor:MadeStatutoryInstrumentSubjectToParliamentaryProcedureWork:2401
2402,Work package for Excise Duties (Miscellaneous Amendments) (EU Exit) (No. 4) Regulations 2019,,false,fJyRupxY,4,,urn:procedure-editor:MadeStatutoryInstrumentSubjectToParliamentaryProcedureWork:2402
2403,Work package for Town and Country Planning (Car Park D Ebbsfleet International Station) (EU Exit) Special Development Order 2019,,false,3Q71RRw9,4,,urn:procedure-editor:MadeStatutoryInstrumentSubjectToParliamentaryProcedureWork:2403
2404,Work package for Town and Country Planning (North Weald Airfield) (EU Exit) Special Development Order 2019,,false,DbbmvjU6,4,,urn:procedure-editor:MadeStatutoryInstrumentSubjectToParliamentaryProcedureWork:2404
2405,Work package for Town and Country Planning (Waterbrook Ashford) (EU Exit) Special Development Order 2019,,false,yPSn4uDP,4,,urn:procedure-editor:MadeStatutoryInstrumentSubjectToParliamentaryProcedureWork:2405
2406,Work package for Data-gathering Powers (Relevant Data) (Amendment) (EU Exit) Regulations 2019,,false,5GQmRi8P,4,,urn:procedure-editor:MadeStatutoryInstrumentSubjectToParliamentaryProcedureWork:2406
2407,Work package for Value Added Tax (Miscellaneous Amendments and Transitional Provisions) (EU Exit) Regulations 2019,,false,h9mbEbfh,4,,urn:procedure-editor:MadeStatutoryInstrumentSubjectToParliamentaryProcedureWork:2407
2408,Work package for Southern Inshore Fisheries and Conservation (Amendment) Order 2019,,false,118jH8o5,4,,urn:procedure-editor:MadeStatutoryInstrumentSubjectToParliamentaryProcedureWork:2408
2409,Work package for Food Information (Amendment) (England) Regulations 2019,,false,MV2e7OEN,4,,urn:procedure-editor:MadeStatutoryInstrumentSubjectToParliamentaryProcedureWork:2409
2410,Work package for Invasive Alien Species (Enforcement and Permitting) (Amendment) Order 2019,,false,bV9F2Rwv,4,,urn:procedure-editor:MadeStatutoryInstrumentSubjectToParliamentaryProcedureWork:2410
2411,Work package for Value Added Tax (Section 55A) (Specified Services and Excepted Supplies) (Change of Commencement Day) Order 2019,,false,bQoj1z6b,4,,urn:procedure-editor:MadeStatutoryInstrumentSubjectToParliamentaryProcedureWork:2411
2412,Work package for North Western Inshore Fisheries and Conservation (Amendment) Order 2019,,false,48t7YKOg,4,,urn:procedure-editor:MadeStatutoryInstrumentSubjectToParliamentaryProcedureWork:2412
2413,Work package for Tonnage Tax (Training Requirement) (Amendment etc.) Regulations 2019,,false,Xy6zt44w,4,,urn:procedure-editor:MadeStatutoryInstrumentSubjectToParliamentaryProcedureWork:2413
2415,Work package for Competition (Amendment etc.) (EU Exit) (No. 2) Regulations 2019,,false,aVLcP86x,1,,urn:procedure-editor:MadeStatutoryInstrumentSubjectToParliamentaryProcedureWork:2415
2416,"Work package for Taxation of Chargeable Gains Act 1992, Schedule 8B (Substitution of Dates) Regulations 2019",,false,vvmDtn5a,4,,urn:procedure-editor:MadeStatutoryInstrumentSubjectToParliamentaryProcedureWork:2416
2417,Work package for Specific Food Hygiene (Regulation (EC) No. 853/2004) (Amendment) (EU Exit) Regulations 2019,,false,wnMJ8407,1,,urn:procedure-editor:MadeStatutoryInstrumentSubjectToParliamentaryProcedureWork:2417
2418,Work package for British Nationality (General) (Amendment) Regulations 2019,,false,vhFTtUeE,4,,urn:procedure-editor:MadeStatutoryInstrumentSubjectToParliamentaryProcedureWork:2418
2420,Work package for Export Control (Sanctions) (Amendment) Order 2019,,false,uF1nrGGz,4,,urn:procedure-editor:MadeStatutoryInstrumentSubjectToParliamentaryProcedureWork:2420
2421,Work package for Social Security (Industrial Injuries) (Prescribed Diseases) Amendment Regulations 2019,,false,MFxd7yiq,4,,urn:procedure-editor:MadeStatutoryInstrumentSubjectToParliamentaryProcedureWork:2421
2422,Work package for Universal Credit (Childcare Costs and Minimum Income Floor) (Amendment) Regulations 2019,,false,OErwR5Np,4,,urn:procedure-editor:MadeStatutoryInstrumentSubjectToParliamentaryProcedureWork:2422
2423,Work package for Universal Credit (Childcare Costs and Minimum Income Floor) (Amendment) Regulations (Northern Ireland) 2019,,false,WXBnhtfx,4,,urn:procedure-editor:MadeStatutoryInstrumentSubjectToParliamentaryProcedureWork:2423
2424,"Work package for Product Safety, Metrology and Mutual Recognition Agreement (Amendment) (EU Exit) Regulations 2019",,false,dZCtFV51,1,,urn:procedure-editor:MadeStatutoryInstrumentSubjectToParliamentaryProcedureWork:2424
