id,label,workpackagedaycount,areclocksinworkpackagefrozen,triplestoreid,subjectto,proceduralworkpackagehascalculationstyle,proceduralworkpackagefocus
3819,Work package for Cumbria (Changes to Years of Elections) Order 2021,,false,ek2LP9H6,4,,urn:procedure-editor:MadeStatutoryInstrumentSubjectToParliamentaryProcedureWork:3819
3820,Work package for North Yorkshire (Changes to Years of Elections) Order 2021,,false,5mHfRSNx,4,,urn:procedure-editor:MadeStatutoryInstrumentSubjectToParliamentaryProcedureWork:3820
3821,Work package for Somerset (Change to Year of Election) Order 2021,,false,Hql6O9Gh,4,,urn:procedure-editor:MadeStatutoryInstrumentSubjectToParliamentaryProcedureWork:3821
3822,Work package for Personal Injuries (NHS Charges) (Amounts) (Amendment) Regulations 2021,,false,oF16Be8i,4,,urn:procedure-editor:MadeStatutoryInstrumentSubjectToParliamentaryProcedureWork:3822
3829,Work package for Restriction of Public Sector Exit Payments (Revocation) Regulations 2021,,false,Rd27keJN,4,,urn:procedure-editor:MadeStatutoryInstrumentSubjectToParliamentaryProcedureWork:3829
3830,Work package for Immigration (Guidance on Detention of Vulnerable Persons) Regulations 2021,,false,0Xey9CsP,4,,urn:procedure-editor:MadeStatutoryInstrumentSubjectToParliamentaryProcedureWork:3830
3831,Work package for Official Controls and Phytosanitary Conditions (Amendment) (No. 2) Regulations 2021,,false,Mx0JrT2Q,4,,urn:procedure-editor:MadeStatutoryInstrumentSubjectToParliamentaryProcedureWork:3831
3832,Work package for Civil Procedure (Amendment No. 2) Rules 2021,,false,AZmxmbso,4,,urn:procedure-editor:MadeStatutoryInstrumentSubjectToParliamentaryProcedureWork:3832
3833,Work package for Housing Benefit (Persons who have attained the qualifying age for state pension credit) (Amendment) Regulations 2021,,false,VwaHGL7Q,4,,urn:procedure-editor:MadeStatutoryInstrumentSubjectToParliamentaryProcedureWork:3833
3834,Work package for High Speed Rail (West Midlands - Crewe) (Planning Appeals) (Written Representations Procedure) Regulations 2021,,false,QXKobvi2,4,,urn:procedure-editor:MadeStatutoryInstrumentSubjectToParliamentaryProcedureWork:3834
3835,Work package for High Speed Rail (West Midlands - Crewe) (Fees for Requests for Planning Approval) Regulations 2021,,false,Rxaq9nzs,4,,urn:procedure-editor:MadeStatutoryInstrumentSubjectToParliamentaryProcedureWork:3835
3837,Work package for Motor Fuel (Composition and Content) and the Biofuel (Labelling) (Amendment) Regulations 2021,,false,pmoQBHFj,4,,urn:procedure-editor:MadeStatutoryInstrumentSubjectToParliamentaryProcedureWork:3837
3838,Work package for Carbon Accounting (Provision for 2019) Regulations 2021,,false,wV6Qr8yb,4,,urn:procedure-editor:MadeStatutoryInstrumentSubjectToParliamentaryProcedureWork:3838
3839,Work package for Education (Student Loans) (Repayment) (Amendment) Regulations 2021,,false,sU6Mxa8m,4,,urn:procedure-editor:MadeStatutoryInstrumentSubjectToParliamentaryProcedureWork:3839
3840,Work package for Airports Slot Allocation (Alleviation of Usage Requirements) Regulations 2021,,false,ZiYxQxFF,4,,urn:procedure-editor:MadeStatutoryInstrumentSubjectToParliamentaryProcedureWork:3840
3843,Work package for School Discipline (Pupil Exclusions and Reviews) (England) (Coronavirus) (Amendment) Regulations 2021,,false,Wt401vqw,4,,urn:procedure-editor:MadeStatutoryInstrumentSubjectToParliamentaryProcedureWork:3843
3844,Work package for Mandatory Travel Concession (England) (Amendment) Regulations 2021,,false,vKFC9iUg,4,,urn:procedure-editor:MadeStatutoryInstrumentSubjectToParliamentaryProcedureWork:3844
3846,"Work package for Health Protection (Coronavirus, International Travel) (England) (Amendment) (No. 9) Regulations 2021",,false,UxsXHHQF,4,,urn:procedure-editor:MadeStatutoryInstrumentSubjectToParliamentaryProcedureWork:3846
3848,Work package for Approved Country Lists (Animals and Animal Products) (Amendment) Regulations 2021,,false,J4rf9iNR,4,,urn:procedure-editor:MadeStatutoryInstrumentSubjectToParliamentaryProcedureWork:3848
3849,Work package for Oil and Gas Authority (Levy and Fees) Regulations 2021,,false,OJdQnYEF,4,,urn:procedure-editor:MadeStatutoryInstrumentSubjectToParliamentaryProcedureWork:3849
3850,Work package for UK Property Rich Collective Investment Vehicles (Amendment of the Taxation of Chargeable Gains Act 1992) Regulations 2021,,false,JCHwen3m,4,,urn:procedure-editor:MadeStatutoryInstrumentSubjectToParliamentaryProcedureWork:3850
3853,Work package for Customs Tariff (Preferential Trade Arrangements) (EU Exit) (Amendment) Regulations 2021,,false,7hu5L2XY,4,,urn:procedure-editor:MadeStatutoryInstrumentSubjectToParliamentaryProcedureWork:3853
3854,Work package for Housing (Shared Ownership Leases) (Exclusion from Leasehold Reform Act 1967 and Rent Act 1977) (England) Regulations 2021,,false,fChpJYas,4,,urn:procedure-editor:MadeStatutoryInstrumentSubjectToParliamentaryProcedureWork:3854
3855,Work package for Occupational and Personal Pension Schemes (General Levy) (Amendment) Regulations 2021,,false,MtJcKTNR,4,,urn:procedure-editor:MadeStatutoryInstrumentSubjectToParliamentaryProcedureWork:3855
3856,Work package for Public Service (Civil Servants and Others) Pensions (Amendment) Regulations 2021,,false,a0Bg7u9a,4,,urn:procedure-editor:MadeStatutoryInstrumentSubjectToParliamentaryProcedureWork:3856
3857,"Work package for Social Security (Claims and Payments, Employment and Support Allowance, Personal Independence Payment and Universal Credit) (Telephone and Video Assessment) (Amendment) Regulations 2021",,false,bIKkJk7G,4,,urn:procedure-editor:MadeStatutoryInstrumentSubjectToParliamentaryProcedureWork:3857
3858,Work package for Universal Credit (Childcare in Wales) (Amendment) Regulations 2021,,false,sVpvHR79,4,,urn:procedure-editor:MadeStatutoryInstrumentSubjectToParliamentaryProcedureWork:3858
3859,Work package for Wildlife and Countryside Act 1981 (Variation of Schedule 9) (England) Order 2021,,false,xmAQnBBQ,4,,urn:procedure-editor:MadeStatutoryInstrumentSubjectToParliamentaryProcedureWork:3859
3860,Work package for Health Protection (Coronavirus) (Wearing of Face Coverings in a Relevant Place and Restrictions: All Tiers) (England) (Amendment) Regulations 2021,,false,NHLjXva2,1,,urn:procedure-editor:MadeStatutoryInstrumentSubjectToParliamentaryProcedureWork:3860
3861,Work package for Early Years Foundation Stage (Learning and Development Requirements) (Coronavirus) (Amendment) Order 2021,,false,43stxzQj,4,,urn:procedure-editor:MadeStatutoryInstrumentSubjectToParliamentaryProcedureWork:3861
3862,Work package for Communications (Television Licensing) (Amendment) (No. 2) Regulations 2021,,false,CG1EV6NR,4,,urn:procedure-editor:MadeStatutoryInstrumentSubjectToParliamentaryProcedureWork:3862
3865,Work package for Income Tax (Pay As You Earn) (Amendment) Regulations 2021,,false,SuPUF94Q,4,,urn:procedure-editor:MadeStatutoryInstrumentSubjectToParliamentaryProcedureWork:3865
3866,Work package for Magistrates? Courts (Amendment) Rules (Northern Ireland) 2021,,false,19GPzCuu,4,,urn:procedure-editor:MadeStatutoryInstrumentSubjectToParliamentaryProcedureWork:3866
3867,Work package for Armed Forces (Enhanced Learning Credit Scheme and Further and Higher Education Commitment Scheme) (Amendment) Order 2021,,false,NfONrL7L,4,,urn:procedure-editor:MadeStatutoryInstrumentSubjectToParliamentaryProcedureWork:3867
3868,"Work package for Health Protection (Coronavirus, International Travel and Information for Passengers) (England) (Amendment) Regulations 2021",,false,oiXMBGai,4,,urn:procedure-editor:MadeStatutoryInstrumentSubjectToParliamentaryProcedureWork:3868
3869,Work package for Guardian?s Allowance Up-rating Regulations 2021,,false,COqW3HRP,4,,urn:procedure-editor:MadeStatutoryInstrumentSubjectToParliamentaryProcedureWork:3869
3870,Work package for Social Security (Contributions) (Amendment) Regulations 2021,,false,D6HVXR8R,4,,urn:procedure-editor:MadeStatutoryInstrumentSubjectToParliamentaryProcedureWork:3870
3872,Work package for Adoption and Children (Coronavirus) (Amendment) Regulations 2021,,false,T8kANMmL,4,,urn:procedure-editor:MadeStatutoryInstrumentSubjectToParliamentaryProcedureWork:3872
3873,Work package for Taxes (Interest Rate) (Amendment) Regulations 2021,,false,qTlIvpYE,4,,urn:procedure-editor:MadeStatutoryInstrumentSubjectToParliamentaryProcedureWork:3873
3874,Work package for Income Tax (Exemption for Coronavirus Related Home Office Expenses) (Amendment) Regulations 2021,,false,ybPqv4ZC,4,,urn:procedure-editor:MadeStatutoryInstrumentSubjectToParliamentaryProcedureWork:3874
3875,Work package for Van Benefit and Car and Van Fuel Benefit Order 2021,,false,OuSI98ve,4,,urn:procedure-editor:MadeStatutoryInstrumentSubjectToParliamentaryProcedureWork:3875
3876,Work package for Accounts and Audit (Amendment) Regulations 2021,,false,rfvnq1G1,4,,urn:procedure-editor:MadeStatutoryInstrumentSubjectToParliamentaryProcedureWork:3876
3877,Work package for Social Security Contributions (Disregarded Payments) (Coronavirus) Regulations 2021,,false,sllb11yz,4,,urn:procedure-editor:MadeStatutoryInstrumentSubjectToParliamentaryProcedureWork:3877
3878,Work package for Social Security Revaluation of Earnings Factors Order 2021,,false,aykE1paj,4,,urn:procedure-editor:MadeStatutoryInstrumentSubjectToParliamentaryProcedureWork:3878
3882,"Work package for Common Organisation of the Markets in Agricultural Products (Wine) (Amendment, etc.) Regulations 2021",,false,JmhuEHZx,1,,urn:procedure-editor:MadeStatutoryInstrumentSubjectToParliamentaryProcedureWork:3882
3883,Work package for Education (Student Support) (Coronavirus) (Amendment) Regulations 2021,,false,DQW7RVlo,4,,urn:procedure-editor:MadeStatutoryInstrumentSubjectToParliamentaryProcedureWork:3883
3884,Work package for Public Sector Apprenticeship Targets (Amendment) Regulations 2021,,false,DTUdwgI9,4,,urn:procedure-editor:MadeStatutoryInstrumentSubjectToParliamentaryProcedureWork:3884
3885,Work package for Immigration and Nationality (Fees) (Amendment) Regulations 2021,,false,p0FLMUEx,4,,urn:procedure-editor:MadeStatutoryInstrumentSubjectToParliamentaryProcedureWork:3885
3886,Work package for Government Resources and Accounts Act 2000 (Estimates and Accounts) Order 2021,,false,6Db6k91e,4,,urn:procedure-editor:MadeStatutoryInstrumentSubjectToParliamentaryProcedureWork:3886
3887,Work package for Business Tenancies (Protection from Forfeiture: Relevant Period) (Coronavirus) (England) Regulations 2021,,false,5t9io5zH,4,,urn:procedure-editor:MadeStatutoryInstrumentSubjectToParliamentaryProcedureWork:3887
3888,Work package for Coronavirus Act 2020 (Residential Tenancies: Protection from Eviction) (Amendment) (England) Regulations 2021,,false,sRFw2q8k,4,,urn:procedure-editor:MadeStatutoryInstrumentSubjectToParliamentaryProcedureWork:3888
3889,Work package for Merchant Shipping (Light Dues) (Amendment) Regulations 2021,,false,3bJaDfbr,4,,urn:procedure-editor:MadeStatutoryInstrumentSubjectToParliamentaryProcedureWork:3889
3890,Work package for Non-Domestic Rating (Transitional Protection Payments and Rates Retention) (Coronavirus) (Amendment) Regulations 2021,,false,rBXLoblC,4,,urn:procedure-editor:MadeStatutoryInstrumentSubjectToParliamentaryProcedureWork:3890
3891,Work package for Statutory Sick Pay (Coronavirus) (Funding of Employers' Liabilities) (Amendment) Regulations and the Statutory Sick Pay (Coronavirus) (Funding of Employers' Liabilities) (Northern Ireland) (Amendment) Regulations 2021,,false,LSCdcJ7R,4,,urn:procedure-editor:MadeStatutoryInstrumentSubjectToParliamentaryProcedureWork:3891
3893,Work package for Recovery of Costs (Remand to Youth Detention Accommodation) (Amendment) Regulations 2021,,false,njlzKVi4,4,,urn:procedure-editor:MadeStatutoryInstrumentSubjectToParliamentaryProcedureWork:3893
3896,Work package for National Health Service Commissioning Board and Clinical Commissioning Groups (Responsibilities and Standing Rules) (Amendment) Regulations 2021,,false,oAZ7f59M,4,,urn:procedure-editor:MadeStatutoryInstrumentSubjectToParliamentaryProcedureWork:3896
3897,Work package for Public Service Pensions Revaluation Order 2021,,false,DGXKeaEH,4,,urn:procedure-editor:MadeStatutoryInstrumentSubjectToParliamentaryProcedureWork:3897
3898,Work package for Taking Control of Goods (Amendment) (Coronavirus) Regulations 2021,,false,n3qxMkSv,4,,urn:procedure-editor:MadeStatutoryInstrumentSubjectToParliamentaryProcedureWork:3898
3901,Work package for Higher Education (Registration Fees) (England) (Amendment) Regulations 2021,,false,cKF6XpTH,4,,urn:procedure-editor:MadeStatutoryInstrumentSubjectToParliamentaryProcedureWork:3901
3902,Work package for Armed Forces and Reserve Forces (Compensation Scheme) (Amendment) Order 2021,,false,zXzQ6Z37,4,,urn:procedure-editor:MadeStatutoryInstrumentSubjectToParliamentaryProcedureWork:3902
3903,Work package for Personal Injuries (Civilians) Scheme (Amendment) Order 2021,,false,L7Unff6U,4,,urn:procedure-editor:MadeStatutoryInstrumentSubjectToParliamentaryProcedureWork:3903
3904,Work package for Social Security Benefits Up-rating Regulations 2021,,false,uvLjKLL6,4,,urn:procedure-editor:MadeStatutoryInstrumentSubjectToParliamentaryProcedureWork:3904
3905,Work package for Social Security Contributions (Intermediaries) (Miscellaneous Amendments) Regulations 2021,,false,9vZi4ONs,4,,urn:procedure-editor:MadeStatutoryInstrumentSubjectToParliamentaryProcedureWork:3905
3908,Work package for Income Tax (Construction Industry Scheme) (Amendment) Regulations 2021,,false,9Axpkjlc,4,,urn:procedure-editor:MadeStatutoryInstrumentSubjectToParliamentaryProcedureWork:3908
3909,Work package for Universal Credit (Extension of Coronavirus Measures) Regulations 2021,,false,eEd6k9QR,4,,urn:procedure-editor:MadeStatutoryInstrumentSubjectToParliamentaryProcedureWork:3909
3910,Work package for Tribunal Procedure (Amendment) Rules 2021,,false,jNJ2PR11,4,,urn:procedure-editor:MadeStatutoryInstrumentSubjectToParliamentaryProcedureWork:3910
3912,Work package for Compulsory Electronic Monitoring Licence Condition Order 2021,,false,6ldvGhQP,4,,urn:procedure-editor:MadeStatutoryInstrumentSubjectToParliamentaryProcedureWork:3912
3913,Work package for Industrial Training (Film Industry Training Board for England and Wales) (Revocation) Order 2021,,false,GHfAsQ1l,4,,urn:procedure-editor:MadeStatutoryInstrumentSubjectToParliamentaryProcedureWork:3913
3914,Work package for Transfer of Functions (Speaker?s Committee) Order 2021,,false,HmfXc2rx,4,,urn:procedure-editor:MadeStatutoryInstrumentSubjectToParliamentaryProcedureWork:3914
3915,Work package for National Health Service (General Medical Services Contracts and Personal Medical Services Agreements) (Amendment) Regulations 2021,,false,PJASelu6,4,,urn:procedure-editor:MadeStatutoryInstrumentSubjectToParliamentaryProcedureWork:3915
3918,Work package for Civil Liability (Specification of Authorised Persons) Regulations 2021,,false,R807DBDA,4,,urn:procedure-editor:MadeStatutoryInstrumentSubjectToParliamentaryProcedureWork:3918
3919,Work package for Renewable Heat Incentive Scheme (Temporary Modification) Regulations 2021,,false,uqZiyusa,4,,urn:procedure-editor:MadeStatutoryInstrumentSubjectToParliamentaryProcedureWork:3919
3920,"Work package for Health Protection (Coronavirus, International Travel) (England) (Amendment) (No. 10) Regulations 2021",,false,KnsLYxmM,4,,urn:procedure-editor:MadeStatutoryInstrumentSubjectToParliamentaryProcedureWork:3920
3922,Work package for Patents (European Patent with Unitary Effect and Unified Patent Court) (Repeal and Revocation) Regulations 2021,,false,ANU5U313,4,,urn:procedure-editor:MadeStatutoryInstrumentSubjectToParliamentaryProcedureWork:3922
3924,"Work package for Health Protection (Coronavirus, Restrictions) (Steps) (England) Regulations 2021",,false,qbu3rBL8,1,,urn:procedure-editor:MadeStatutoryInstrumentSubjectToParliamentaryProcedureWork:3924
3938,Work package for Public Health (Coronavirus) (Protection from Eviction) (England) (No. 2) (Amendment) Regulations 2021,,false,gHAet1Ly,1,,urn:procedure-editor:MadeStatutoryInstrumentSubjectToParliamentaryProcedureWork:3938
3939,Work package for Meat Preparations (Amendment and Transitory Modification) (England) (EU Exit) (Amendment) Regulations 2021,,false,B2Yoy8bW,4,,urn:procedure-editor:MadeStatutoryInstrumentSubjectToParliamentaryProcedureWork:3939
3942,Work package for Abortion (Northern Ireland) Regulations 2021,,false,UJtH1t9m,1,,urn:procedure-editor:MadeStatutoryInstrumentSubjectToParliamentaryProcedureWork:3942
3943,Work package for Value Added Tax (Section 55A) (Specified Goods and Services and Excepted Supplies) (Amendment) Order 2021,,false,6F3ZxniM,4,,urn:procedure-editor:MadeStatutoryInstrumentSubjectToParliamentaryProcedureWork:3943
3945,Work package for Corporate Insolvency and Governance Act 2020 (Coronavirus) (Extension of the Relevant Period) Regulations 2021,,false,RmYT4YTi,1,,urn:procedure-editor:MadeStatutoryInstrumentSubjectToParliamentaryProcedureWork:3945
3946,Work package for Customs (Tariff etc.) (Amendment) Regulations 2021,,false,uCZWgfCC,4,,urn:procedure-editor:MadeStatutoryInstrumentSubjectToParliamentaryProcedureWork:3946
3947,Work package for Customs Tariff (Preferential Trade Arrangements and Tariff Quotas) (EU Exit) (Amendment) Regulations 2021,,false,3QCWgmm8,4,,urn:procedure-editor:MadeStatutoryInstrumentSubjectToParliamentaryProcedureWork:3947
3952,Work package for Money Laundering and Terrorist Financing (Amendment) (High-Risk Countries) Regulations 2021,,false,ezcVAdaO,1,,urn:procedure-editor:MadeStatutoryInstrumentSubjectToParliamentaryProcedureWork:3952
3954,"Work package for Education (Coronavirus) (School Teachers' Qualifications, Induction, Inspection Arrangements, Etc) (Amendment) Regulations 2021",,false,RfA46D8p,4,,urn:procedure-editor:MadeStatutoryInstrumentSubjectToParliamentaryProcedureWork:3954
3955,Work package for Vegetable and Ornamental Plant Propagating Material and Fodder Plant Seed (Amendment) Regulations 2021,,false,v9xEz5CH,4,,urn:procedure-editor:MadeStatutoryInstrumentSubjectToParliamentaryProcedureWork:3955
3956,Work package for Valuation for Rating (Coronavirus) (England) Regulations 2021,,false,1Knce8iP,4,,urn:procedure-editor:MadeStatutoryInstrumentSubjectToParliamentaryProcedureWork:3956
3958,Work package for Football Spectators (2020 UEFA European Championship Control Period) Order 2021,,false,clwJ3OTo,4,,urn:procedure-editor:MadeStatutoryInstrumentSubjectToParliamentaryProcedureWork:3958
3959,Work package for Restriction of the Use of Certain Hazardous Substances in Electrical and Electronic Equipment (Amendment) Regulations 2021,,false,MtSQVUKx,4,,urn:procedure-editor:MadeStatutoryInstrumentSubjectToParliamentaryProcedureWork:3959
3960,"Work package for Official Controls, Plant Health, Seeds and Seed Potatoes (Amendment etc.) Regulations 2021",,false,LFgVQT58,4,,urn:procedure-editor:MadeStatutoryInstrumentSubjectToParliamentaryProcedureWork:3960
3961,Work package for Bee Diseases and Pests Control (England) (Amendment) Order 2021,,false,LTOZWHBx,4,,urn:procedure-editor:MadeStatutoryInstrumentSubjectToParliamentaryProcedureWork:3961
3962,Work package for Early Years Foundation Stage (Miscellaneous Amendments) and Childcare Fees (Amendment) Regulations 2021,,false,F2kok1JL,4,,urn:procedure-editor:MadeStatutoryInstrumentSubjectToParliamentaryProcedureWork:3962
3963,Work package for Town and Country Planning (General Permitted Development etc.) (England) (Amendment) Order 2021,,false,U0Lmy14j,4,,urn:procedure-editor:MadeStatutoryInstrumentSubjectToParliamentaryProcedureWork:3963
3964,Work package for Trade and Official Controls (Transitional Arrangements for Prior Notifications) (Amendment) Regulations 2021,,false,CEC4VG5r,1,,urn:procedure-editor:MadeStatutoryInstrumentSubjectToParliamentaryProcedureWork:3964
3965,Work package for Industrial Training Levy (Construction Industry Training Board) Order 2021,,false,w6V1WDEU,4,,urn:procedure-editor:MadeStatutoryInstrumentSubjectToParliamentaryProcedureWork:3965
3966,"Work package for Health Protection (Coronavirus, International Travel) (England) (Amendment) (No. 11) Regulations 2021",,false,wy6fjcWl,4,,urn:procedure-editor:MadeStatutoryInstrumentSubjectToParliamentaryProcedureWork:3966
3967,Work package for Marriage and Civil Partnership (Conversion of Civil Partnership and Fees) (Amendment) Regulations 2021,,false,VbEvPRVF,4,,urn:procedure-editor:MadeStatutoryInstrumentSubjectToParliamentaryProcedureWork:3967
3968,Work package for Trade Preference Scheme (EU Exit) (Amendment) Regulations 2021,,false,AxBhIh9g,4,,urn:procedure-editor:MadeStatutoryInstrumentSubjectToParliamentaryProcedureWork:3968
3970,"Work package for Health Protection (Coronavirus, International Travel) (England) (Amendment) (No. 12) Regulations 2021",,false,hlSSGzzt,4,,urn:procedure-editor:MadeStatutoryInstrumentSubjectToParliamentaryProcedureWork:3970
3971,Work package for National College for Advanced Transport and Infrastructure (Designated Institution in Further Education and Revocations) Order 2021,,false,jComXQZz,4,,urn:procedure-editor:MadeStatutoryInstrumentSubjectToParliamentaryProcedureWork:3971
3972,Work package for Official Controls (Exemptions from Controls at Border Control Posts) (Amendment) Regulations 2021,,false,oMydM2Zk,4,,urn:procedure-editor:MadeStatutoryInstrumentSubjectToParliamentaryProcedureWork:3972
3973,"Work package for Health Protection (Coronavirus, International Travel and Information for Passengers) (England) (Amendment) (No. 2) Regulations 2021",,false,Q0Rba11M,4,,urn:procedure-editor:MadeStatutoryInstrumentSubjectToParliamentaryProcedureWork:3973
3974,"Work package for Health Protection (Coronavirus, Restrictions) (Steps and Local Authority Enforcement Powers) (England) (Amendment) Regulations 2021",,false,nzZ8P6rd,1,,urn:procedure-editor:MadeStatutoryInstrumentSubjectToParliamentaryProcedureWork:3974
3975,Work package for Scarborough Borough Council (Removal of Pilotage Functions) Order 2021,,false,bwBbsCv3,4,,urn:procedure-editor:MadeStatutoryInstrumentSubjectToParliamentaryProcedureWork:3975
3976,Work package for Civil Proceedings and Gender Recognition Application Fees (Amendment) Order 2021,,false,fB0wUXC0,4,,urn:procedure-editor:MadeStatutoryInstrumentSubjectToParliamentaryProcedureWork:3976
3977,Work package for Magistrates? Courts (Amendment) Rules 2021,,false,CBfzxIRH,4,,urn:procedure-editor:MadeStatutoryInstrumentSubjectToParliamentaryProcedureWork:3977
3978,Work package for Removal and Disposal of Vehicles (Amendment) (England) Regulations 2021,,false,0wRRhBZT,4,,urn:procedure-editor:MadeStatutoryInstrumentSubjectToParliamentaryProcedureWork:3978
3979,Work package for Social Security (Claims and Payments) (Amendment) Regulations 2021,,false,4qv84EGr,4,,urn:procedure-editor:MadeStatutoryInstrumentSubjectToParliamentaryProcedureWork:3979
3981,Work package for Solvency 2 (Credit Risk Adjustment) Regulations 2021,,false,cmIWVsXJ,4,,urn:procedure-editor:MadeStatutoryInstrumentSubjectToParliamentaryProcedureWork:3981
3983,Work package for Supervision of Accounts and Reports (Prescribed Body) and Companies (Defective Accounts and Reports) (Authorised Person) Order 2021,,false,ifyINXmi,4,,urn:procedure-editor:MadeStatutoryInstrumentSubjectToParliamentaryProcedureWork:3983
3984,Work package for Town and Country Planning (General Permitted Development) (England) (Amendment) (Coronavirus) Order 2021,,false,4xI78pFy,4,,urn:procedure-editor:MadeStatutoryInstrumentSubjectToParliamentaryProcedureWork:3984
3986,Work package for Protection of Wrecks (RMS Titanic) (Amendment) Order 2021,,false,mgFkPBZs,4,,urn:procedure-editor:MadeStatutoryInstrumentSubjectToParliamentaryProcedureWork:3986
3987,Work package for Customs (Miscellaneous Amendments) Regulations 2021,,false,Rf3u65Ja,4,,urn:procedure-editor:MadeStatutoryInstrumentSubjectToParliamentaryProcedureWork:3987
3988,Work package for Social Security (Coronavirus) (Miscellaneous Amendments) Regulations 2021,,false,zBf0Wd96,4,,urn:procedure-editor:MadeStatutoryInstrumentSubjectToParliamentaryProcedureWork:3988
3993,Work package for Education (Pupil Information) (England) (Coronavirus) (Amendment) Regulations 2021,,false,zuZ9le4H,4,,urn:procedure-editor:MadeStatutoryInstrumentSubjectToParliamentaryProcedureWork:3993
3994,"Work package for Employment Rights Act 1996 (Coronavirus, Calculation of a Week?s Pay) (Amendment) (No. 2) Regulations 2021",,false,kyI9MCkX,4,,urn:procedure-editor:MadeStatutoryInstrumentSubjectToParliamentaryProcedureWork:3994
3995,Work package for Taxation Cross-border Trade (Northern Ireland) (EU Exit) (Amendment) Regulations 2021,,false,GZxcJzO6,4,,urn:procedure-editor:MadeStatutoryInstrumentSubjectToParliamentaryProcedureWork:3995
3997,"Work package for Health Protection (Coronavirus, International Travel) (England) (Amendment) (No. 13) Regulations 2021",,false,26nMeWkz,4,,urn:procedure-editor:MadeStatutoryInstrumentSubjectToParliamentaryProcedureWork:3997
3998,Work package for Social Security and Tax Credits (Miscellaneous and Coronavirus Amendments) Regulations 2021,,false,2QmbKaA8,4,,urn:procedure-editor:MadeStatutoryInstrumentSubjectToParliamentaryProcedureWork:3998
3999,Work package for International Tax Compliance (Amendment) Regulations 2021,,false,5oEiKXUs,4,,urn:procedure-editor:MadeStatutoryInstrumentSubjectToParliamentaryProcedureWork:3999
4000,Work package for Criminal Legal Aid (Remuneration) (Amendment) (No. 2) Regulations 2021,,false,ZTG6XAE1,4,,urn:procedure-editor:MadeStatutoryInstrumentSubjectToParliamentaryProcedureWork:4000
4003,Work package for Global Anti-Corruption Sanctions Regulations 2021,,false,aLe07g9f,1,,urn:procedure-editor:MadeStatutoryInstrumentSubjectToParliamentaryProcedureWork:4003
4004,Work package for Family Court (Composition and Distribution of Business) (Amendment) Rules 2021,,false,LjVTb6P0,4,,urn:procedure-editor:MadeStatutoryInstrumentSubjectToParliamentaryProcedureWork:4004
